238,b7816895-f18f-4312-8a9c-b62ef8fb3f09,2023-12-07T20:07:06.000Z,2023-12-07T20:07:06.000Z,approved,2024-11-28,5 Stars,It is a sturdy and beautiful chair. Very comfortable and easy to assemble. ,5 Stars: It is a sturdy and beautiful chair. Very comfortable and easy to assemble. ,5,1.0,0,0,False,Verve Chair,Coral / Standard,//www.branchfurniture.com/products/verve-chair,https://cdn.shopify.com/s/files/1/0124/5662/4187/files/20220513_VerveChair_FrontPersp_Coral_x280.jpg?v=1695306444,39633980293155,,,,,0,not mentioned,0,not mentioned,0,not mentioned,0,not mentioned,0,not mentioned,1,positive,0,not mentioned,0,not mentioned,0,not mentioned,1,positive,0,not mentioned,0,not mentioned,1,positive,1,positive,0,not mentioned,0,not mentioned,0,not mentioned,1,positive,0,not mentioned,0,not mentioned
239,68da3b33-0956-4796-b8b0-c9ad2aa71ae6,2023-12-07T20:03:25.657Z,2023-12-07T20:03:25.657Z,approved,2024-11-28,5 Stars,"Comfortable chair, good support, and looks great!","5 Stars: Comfortable chair, good support, and looks great!",5,1.0,0,0,False,Verve Chair,,//www.branchfurniture.com/products/verve-chair,https://cdn.shopify.com/s/files/1/0124/5662/4187/products/coralherocopy_x280.jpg?v=1652368917,,,,,,0,not mentioned,0,not mentioned,0,not mentioned,0,not mentioned,0,not mentioned,1,positive,1,positive,0,not mentioned,0,not mentioned,0,not mentioned,0,not mentioned,1,positive,1,positive,1,positive,0,not mentioned,0,not mentioned,0,not mentioned,1,positive,0,not mentioned,0,not mentioned
240,9530b639-3dd6-4b1f-b4f3-6b0d68b50174,2023-12-07T20:01:22.953Z,2023-12-07T20:01:22.953Z,approved,2024-11-28,5 Stars,"absolutely blown away by the build quality, design, and installation procedure for this chair. The milling and heft of the connector pieces is unlike any flat pack product I have ever seen. Even the hex wrench supplied was made to use, so much so I didn’t even bother getting one of mine - definitely not your typical “L” wrench. The fact that branch even throws wrench in two extra bolts (one of each type) is just the sort of thing that costs very little on the front end and can solve enumerable inconvenience down the road. 

Now if the chair was uncomfortable, no one would care about the great design or robust materials, but the fact is at 6’4” I found it a great chair and at 5’4” my wife did to. The chair is for easily adjustable- unlike so many that have tons of levers that have little or no discernible function or one that practically gives you whiplash. my wife does tele-health daily and a quality chair is essential. this chair has put a smile on her face for sure!","5 Stars: absolutely blown away by the build quality, design, and installation procedure for this chair. The milling and heft of the connector pieces is unlike any flat pack product I have ever seen. Even the hex wrench supplied was made to use, so much so I didn’t even bother getting one of mine - definitely not your typical “L” wrench. The fact that branch even throws wrench in two extra bolts (one of each type) is just the sort of thing that costs very little on the front end and can solve enumerable inconvenience down the road. 

Now if the chair was uncomfortable, no one would care about the great design or robust materials, but the fact is at 6’4” I found it a great chair and at 5’4” my wife did to. The chair is for easily adjustable- unlike so many that have tons of levers that have little or no discernible function or one that practically gives you whiplash. my wife does tele-health daily and a quality chair is essential. this chair has put a smile on her face for sure!",5,1.0,0,0,False,Verve Chair,,//www.branchfurniture.com/products/verve-chair,https://cdn.shopify.com/s/files/1/0124/5662/4187/products/coralherocopy_x280.jpg?v=1652368917,,,,,,1,positive,1,positive,0,not mentioned,0,not mentioned,0,not mentioned,1,positive,1,positive,1,positive,0,not mentioned,1,positive,0,not mentioned,0,not mentioned,1,positive,1,positive,0,not mentioned,0,not mentioned,1,positive,1,positive,0,not mentioned,0,not mentioned
241,329a1d88-10ea-4343-9bc7-02bb995815a6,2023-12-07T20:01:22.000Z,2023-12-07T20:01:22.000Z,approved,2024-11-28,5 Stars,"absolutely blown away by the build quality, design, and installation procedure for this chair. The milling and heft of the connector pieces is unlike any flat pack product I have ever seen. Even the hex wrench supplied was made to use, so much so I didn’t even bother getting one of mine - definitely not your typical “L” wrench. The fact that branch even throws wrench in two extra bolts (one of each type) is just the sort of thing that costs very little on the front end and can solve enumerable inconvenience down the road. 

Now if the chair was uncomfortable, no one would care about the great design or robust materials, but the fact is at 6’4” I found it a great chair and at 5’4” my wife did to. The chair is for easily adjustable- unlike so many that have tons of levers that have little or no discernible function or one that practically gives you whiplash. my wife does tele-health daily and a quality chair is essential. this chair has put a smile on her face for sure!","5 Stars: absolutely blown away by the build quality, design, and installation procedure for this chair. The milling and heft of the connector pieces is unlike any flat pack product I have ever seen. Even the hex wrench supplied was made to use, so much so I didn’t even bother getting one of mine - definitely not your typical “L” wrench. The fact that branch even throws wrench in two extra bolts (one of each type) is just the sort of thing that costs very little on the front end and can solve enumerable inconvenience down the road. 

Now if the chair was uncomfortable, no one would care about the great design or robust materials, but the fact is at 6’4” I found it a great chair and at 5’4” my wife did to. The chair is for easily adjustable- unlike so many that have tons of levers that have little or no discernible function or one that practically gives you whiplash. my wife does tele-health daily and a quality chair is essential. this chair has put a smile on her face for sure!",5,1.0,0,0,False,Verve Chair,Mist / Standard,//www.branchfurniture.com/products/verve-chair,https://cdn.shopify.com/s/files/1/0124/5662/4187/files/20220513_VerveChair_FrontPersp_Mist_x280.jpg?v=1695306444,39633980325923,,,,,1,positive,1,positive,0,not mentioned,0,not mentioned,0,not mentioned,1,positive,1,positive,1,positive,0,not mentioned,1,positive,0,not mentioned,0,not mentioned,1,positive,1,positive,0,not mentioned,0,not mentioned,1,positive,1,positive,0,not mentioned,0,not mentioned
242,24f97f5b-6d6c-4869-90fc-eeaa80bd9ea3,2023-12-07T19:56:14.987Z,2023-12-07T19:56:14.987Z,approved,2024-11-28,5 Stars,Good chair. Nice looking,5 Stars: Good chair. Nice looking,5,1.0,0,0,False,Verve Chair,,//www.branchfurniture.com/products/verve-chair,https://cdn.shopify.com/s/files/1/0124/5662/4187/products/coralherocopy_x280.jpg?v=1652368917,,,,,,0,not mentioned,0,not mentioned,0,not mentioned,0,not mentioned,0,not mentioned,0,not mentioned,0,not mentioned,0,not mentioned,0,not mentioned,0,not mentioned,0,not mentioned,0,not mentioned,0,not mentioned,0,not mentioned,0,not mentioned,0,not mentioned,0,not mentioned,1,positive,0,not mentioned,0,not mentioned
243,4ad87b28-44b5-4477-a8d0-b1743b72c48b,2023-12-07T19:56:14.000Z,2023-12-07T19:56:14.000Z,approved,2024-11-28,5 Stars,Good chair. Nice looking ,5 Stars: Good chair. Nice looking ,5,1.0,0,0,False,Verve Chair,Mist / Standard,//www.branchfurniture.com/products/verve-chair,https://cdn.shopify.com/s/files/1/0124/5662/4187/files/20220513_VerveChair_FrontPersp_Mist_x280.jpg?v=1695306444,39633980325923,,,,,0,not mentioned,0,not mentioned,0,not mentioned,0,not mentioned,0,not mentioned,0,not mentioned,0,not mentioned,0,not mentioned,0,not mentioned,0,not mentioned,0,not mentioned,0,not mentioned,0,not mentioned,0,not mentioned,0,not mentioned,0,not mentioned,0,not mentioned,1,positive,0,not mentioned,0,not mentioned
244,af91c919-2a02-43a5-9df0-49f4231fa4bc,2023-12-07T19:54:24.067Z,2023-12-07T19:54:24.067Z,approved,2024-11-28,5 Stars,The chair is amazing,5 Stars: The chair is amazing,5,1.0,0,0,False,Verve Chair,,//www.branchfurniture.com/products/verve-chair,https://cdn.shopify.com/s/files/1/0124/5662/4187/products/coralherocopy_x280.jpg?v=1652368917,,,,,,0,not mentioned,0,not mentioned,0,not mentioned,0,not mentioned,0,not mentioned,0,not mentioned,0,not mentioned,0,not mentioned,0,not mentioned,0,not mentioned,0,not mentioned,0,not mentioned,0,not mentioned,0,not mentioned,0,not mentioned,0,not mentioned,0,not mentioned,1,positive,0,not mentioned,0,not mentioned
245,36b6498d-c33d-470d-827f-1c4edf7792dc,2023-12-07T19:53:14.223Z,2023-12-07T19:53:14.223Z,approved,2024-11-28,5 Stars,Worth every dime.,5 Stars: Worth every dime.,5,1.0,0,0,False,Verve Chair,,//www.branchfurniture.com/products/verve-chair,https://cdn.shopify.com/s/files/1/0124/5662/4187/products/coralherocopy_x280.jpg?v=1652368917,,,,,,0,not mentioned,0,not mentioned,0,not mentioned,0,not mentioned,0,not mentioned,1,positive,0,not mentioned,0,not mentioned,0,not mentioned,0,not mentioned,0,not mentioned,0,not mentioned,0,not mentioned,0,not mentioned,0,not mentioned,0,not mentioned,0,not mentioned,0,not mentioned,0,not mentioned,0,not mentioned
246,8099eace-c197-4256-b2af-7639656255a5,2023-12-07T19:51:26.090Z,2023-12-07T19:51:26.090Z,approved,2024-11-28,5 Stars,"Very comfy, looks great!","5 Stars: Very comfy, looks great!",5,1.0,0,0,False,Verve Chair,,//www.branchfurniture.com/products/verve-chair,https://cdn.shopify.com/s/files/1/0124/5662/4187/products/coralherocopy_x280.jpg?v=1652368917,,,,,,0,not mentioned,0,not mentioned,0,not mentioned,0,not mentioned,0,not mentioned,1,positive,0,not mentioned,0,not mentioned,0,not mentioned,0,not mentioned,0,not mentioned,0,not mentioned,1,positive,1,positive,0,not mentioned,0,not mentioned,0,not mentioned,1,positive,0,not mentioned,0,not mentioned
247,4695b6a8-f335-4958-b5c5-2ecfd052e3d2,2023-12-07T19:51:26.000Z,2023-12-07T19:51:26.000Z,approved,2024-11-28,5 Stars,"Very comfy, looks great!","5 Stars: Very comfy, looks great!",5,1.0,0,0,False,Verve Chair,Mist / Standard,//www.branchfurniture.com/products/verve-chair,https://cdn.shopify.com/s/files/1/0124/5662/4187/files/20220513_VerveChair_FrontPersp_Mist_x280.jpg?v=1695306444,39633980325923,,,,,0,not mentioned,0,not mentioned,0,not mentioned,0,not mentioned,0,not mentioned,1,positive,0,not mentioned,0,not mentioned,0,not mentioned,0,not mentioned,0,not mentioned,0,not mentioned,1,positive,1,positive,0,not mentioned,0,not mentioned,0,not mentioned,1,positive,0,not mentioned,0,not mentioned
248,78d49471-ade3-43e4-8450-e5e06c443299,2023-12-07T19:43:27.697Z,2023-12-07T19:43:27.697Z,approved,2024-11-28,5 Stars,"Love it! It’s comfortable, functional, and super easy to assemble.","5 Stars: Love it! It’s comfortable, functional, and super easy to assemble.",5,1.0,0,0,False,Verve Chair,,//www.branchfurniture.com/products/verve-chair,https://cdn.shopify.com/s/files/1/0124/5662/4187/products/coralherocopy_x280.jpg?v=1652368917,,,,,,0,not mentioned,0,not mentioned,0,not mentioned,0,not mentioned,0,not mentioned,0,not mentioned,0,not mentioned,0,not mentioned,0,not mentioned,1,positive,0,not mentioned,0,not mentioned,0,not mentioned,1,positive,0,not mentioned,0,not mentioned,0,not mentioned,0,not mentioned,0,not mentioned,0,not mentioned
249,1abab18a-4f0d-4d1a-b447-7861763bbd0d,2023-12-07T19:41:04.857Z,2023-12-07T19:41:04.857Z,approved,2024-11-28,5 Stars,Love the color. Hefty and well constructed. Very comfortable and adjustable.,5 Stars: Love the color. Hefty and well constructed. Very comfortable and adjustable.,5,1.0,0,0,False,Verve Chair,,//www.branchfurniture.com/products/verve-chair,https://cdn.shopify.com/s/files/1/0124/5662/4187/products/coralherocopy_x280.jpg?v=1652368917,,,,,,0,not mentioned,1,positive,0,not mentioned,0,not mentioned,0,not mentioned,1,positive,0,not mentioned,0,not mentioned,0,not mentioned,0,not mentioned,0,not mentioned,0,not mentioned,1,positive,1,positive,0,not mentioned,0,not mentioned,0,not mentioned,1,positive,0,not mentioned,0,not mentioned
250,a310a944-b405-46dc-9aa5-5692035a91ae,2023-12-07T19:38:31.237Z,2023-12-07T19:38:31.237Z,approved,2024-11-28,5 Stars,The best office chair I have ever sat on!,5 Stars: The best office chair I have ever sat on!,5,1.0,0,0,False,Verve Chair,,//www.branchfurniture.com/products/verve-chair,https://cdn.shopify.com/s/files/1/0124/5662/4187/products/coralherocopy_x280.jpg?v=1652368917,,,,,,0,not mentioned,0,not mentioned,0,not mentioned,0,not mentioned,0,not mentioned,0,not mentioned,1,positive,0,not mentioned,0,not mentioned,0,not mentioned,0,not mentioned,0,not mentioned,0,not mentioned,0,not mentioned,0,not mentioned,0,not mentioned,0,not mentioned,0,not mentioned,0,not mentioned,0,not mentioned
251,bc0dd18e-da5b-4c05-bbf8-ce28a75652df,2023-12-07T19:37:18.810Z,2023-12-07T19:37:18.810Z,approved,2024-11-28,5 Stars,"I'm 43 years old and have sat in many chairs throughout my 20+ years in the workforce. None of them compare to this chair. Now that I work from home, it's imperative that I have something that I enjoy sitting in. This chair is comfortable, stylish, flexible, and easy to put together. It feels sturdy and glides across my floor with ease. The price is worth every cent and I would easily buy it again if needed. I will recommend this to anyone looking for a gorgeous and comfortable fixture in their home.","5 Stars: I'm 43 years old and have sat in many chairs throughout my 20+ years in the workforce. None of them compare to this chair. Now that I work from home, it's imperative that I have something that I enjoy sitting in. This chair is comfortable, stylish, flexible, and easy to put together. It feels sturdy and glides across my floor with ease. The price is worth every cent and I would easily buy it again if needed. I will recommend this to anyone looking for a gorgeous and comfortable fixture in their home.",5,1.0,0,0,False,Verve Chair,,//www.branchfurniture.com/products/verve-chair,https://cdn.shopify.com/s/files/1/0124/5662/4187/products/coralherocopy_x280.jpg?v=1652368917,,,,,,1,positive,1,positive,0,not mentioned,1,positive,0,not mentioned,1,positive,1,positive,0,not mentioned,0,not mentioned,1,positive,0,not mentioned,1,positive,1,positive,1,positive,0,not mentioned,0,not mentioned,0,not mentioned,1,positive,0,not mentioned,1,positive
252,10a3b7f1-cca5-4a59-bbe6-9464ca1729d7,2023-12-07T19:34:26.537Z,2023-12-07T19:34:26.537Z,approved,2024-11-28,5 Stars,Comfortable to sit on all day!,5 Stars: Comfortable to sit on all day!,5,1.0,0,0,False,Verve Chair,,//www.branchfurniture.com/products/verve-chair,https://cdn.shopify.com/s/files/1/0124/5662/4187/products/coralherocopy_x280.jpg?v=1652368917,,,,,,0,not mentioned,0,not mentioned,0,not mentioned,0,not mentioned,0,not mentioned,0,not mentioned,0,not mentioned,0,not mentioned,0,not mentioned,0,not mentioned,0,not mentioned,0,not mentioned,0,not mentioned,1,positive,0,not mentioned,0,not mentioned,0,not mentioned,0,not mentioned,0,not mentioned,0,not mentioned
253,e0dd3dea-022e-45bc-8976-42ef36e34199,2023-12-07T19:33:26.700Z,2023-12-07T19:33:26.700Z,approved,2024-11-28,5 Stars,Very comfortable and looks great in my office!,5 Stars: Very comfortable and looks great in my office!,5,1.0,0,0,False,Verve Chair,,//www.branchfurniture.com/products/verve-chair,https://cdn.shopify.com/s/files/1/0124/5662/4187/products/coralherocopy_x280.jpg?v=1652368917,,,,,,0,not mentioned,0,not mentioned,0,not mentioned,0,not mentioned,0,not mentioned,1,positive,1,positive,0,not mentioned,0,not mentioned,0,not mentioned,0,not mentioned,0,not mentioned,0,not mentioned,1,positive,0,not mentioned,0,not mentioned,0,not mentioned,1,positive,0,not mentioned,0,not mentioned
254,8e25608c-5f9e-45d7-92e8-f0648f620b1e,2023-12-03T19:57:26.700Z,2023-12-03T19:57:26.700Z,approved,2024-11-28,5 Stars,"Perfect for our modern office. Very comfortable, especially with the lumbar support.","5 Stars: Perfect for our modern office. Very comfortable, especially with the lumbar support.",5,1.0,0,0,False,Verve Chair,,//www.branchfurniture.com/products/verve-chair,https://cdn.shopify.com/s/files/1/0124/5662/4187/products/coralherocopy_x280.jpg?v=1652368917,,,,,,0,not mentioned,0,not mentioned,0,not mentioned,0,not mentioned,0,not mentioned,0,not mentioned,0,not mentioned,0,not mentioned,0,not mentioned,0,not mentioned,0,not mentioned,1,positive,1,positive,1,positive,0,not mentioned,0,not mentioned,0,not mentioned,1,positive,0,not mentioned,0,not mentioned
255,83f282b9-7e61-413e-b2cc-8b3122cfe638,2023-12-03T19:57:26.000Z,2023-12-03T19:57:26.000Z,approved,2024-11-28,5 Stars,"Perfect for our modern office. Very comfortable, especially with the lumbar support.","5 Stars: Perfect for our modern office. Very comfortable, especially with the lumbar support.",5,1.0,0,0,False,Verve Chair,Mist / Standard,//www.branchfurniture.com/products/verve-chair,https://cdn.shopify.com/s/files/1/0124/5662/4187/files/20220513_VerveChair_FrontPersp_Mist_x280.jpg?v=1695306444,39633980325923,,,,,0,not mentioned,0,not mentioned,0,not mentioned,1,positive,0,not mentioned,0,not mentioned,0,not mentioned,0,not mentioned,0,not mentioned,0,not mentioned,0,not mentioned,1,positive,0,not mentioned,1,positive,0,not mentioned,0,not mentioned,0,not mentioned,1,positive,0,not mentioned,0,not mentioned
256,7a145bfc-5d8d-4950-b99a-0be62683cdd9,2023-12-02T17:01:40.607Z,2023-12-02T17:01:40.607Z,approved,2024-11-28,"Wonderful, ergonomic, high-quality, beautifully designed chair!","First, regarding the size of this chair: this is a standard size office chair which should fit most people in a fairly wide middle range of the height and weight curve. I am a 6'0"", 175-pounds male and this chair fits me perfectly, with plenty of room left and additional height adjustment available, so it's hard for me to understand reviews complaining about the small size. This chair was designed so thoughtfully and economically that all unnecessary bulk was eliminated, contributing to it's very elegant and esthetically pleasing appearance. The quality of the materials is top-notch, warm and pleasant to the touch. The seat is soft and yet firm enough to keep me from sinking to the bottom of the seat frame like I did in every other office chair I tried. Like the rest of this chair, the ergonomics were designed thoughtfully to fit most people's needs, without pilling on unnecessary adjustments. The back support on this chair is the most comfortable and effective I've experienced. Overall, this is the best office chair of the many, many... many I have tried and a tremendous value. I do, however, understand that chairs are kind of like clothes and shoes where one size does not fit all, but I sure am glad this one was a fit for me. PS: I even liked the arm rests system! Very elegant and functional.","Wonderful, ergonomic, high-quality, beautifully designed chair!: First, regarding the size of this chair: this is a standard size office chair which should fit most people in a fairly wide middle range of the height and weight curve. I am a 6'0"", 175-pounds male and this chair fits me perfectly, with plenty of room left and additional height adjustment available, so it's hard for me to understand reviews complaining about the small size. This chair was designed so thoughtfully and economically that all unnecessary bulk was eliminated, contributing to it's very elegant and esthetically pleasing appearance. The quality of the materials is top-notch, warm and pleasant to the touch. The seat is soft and yet firm enough to keep me from sinking to the bottom of the seat frame like I did in every other office chair I tried. Like the rest of this chair, the ergonomics were designed thoughtfully to fit most people's needs, without pilling on unnecessary adjustments. The back support on this chair is the most comfortable and effective I've experienced. Overall, this is the best office chair of the many, many... many I have tried and a tremendous value. I do, however, understand that chairs are kind of like clothes and shoes where one size does not fit all, but I sure am glad this one was a fit for me. PS: I even liked the arm rests system! Very elegant and functional.",5,1.0,0,0,False,Verve Chair,,//www.branchfurniture.com/products/verve-chair,https://cdn.shopify.com/s/files/1/0124/5662/4187/products/coralherocopy_x280.jpg?v=1652368917,,,,,,1,positive,1,positive,1,positive,1,positive,1,positive,1,positive,1,positive,0,not mentioned,0,not mentioned,0,not mentioned,0,not mentioned,1,positive,1,positive,1,positive,0,not mentioned,1,positive,1,positive,1,positive,0,not mentioned,0,not mentioned
257,f2ab9707-9b65-4c28-a569-cf6698f205e4,2023-11-27T22:12:04.897Z,2023-11-27T22:12:04.897Z,approved,2024-11-28,Love this chair,"I was hesitant to purchase because of the price, but ended up ordering it during the BFCM sale. I have absolutely no regrets, this is the comfiest chair I've ever sat on in my life and the mint color is just beautiful. My back doesn't hurt at all after sitting for a full 8 hour work day. To anyone who's on the fence about purchasing this chair, just get it!","Love this chair: I was hesitant to purchase because of the price, but ended up ordering it during the BFCM sale. I have absolutely no regrets, this is the comfiest chair I've ever sat on in my life and the mint color is just beautiful. My back doesn't hurt at all after sitting for a full 8 hour work day. To anyone who's on the fence about purchasing this chair, just get it!",5,1.0,0,0,False,Verve Chair,,//www.branchfurniture.com/products/verve-chair,https://cdn.shopify.com/s/files/1/0124/5662/4187/products/coralherocopy_x280.jpg?v=1652368917,,,,,,0,not mentioned,0,not mentioned,0,not mentioned,1,positive,0,not mentioned,1,positive,1,positive,0,not mentioned,0,not mentioned,0,not mentioned,0,not mentioned,1,positive,0,not mentioned,1,positive,0,not mentioned,0,not mentioned,0,not mentioned,1,positive,0,not mentioned,0,not mentioned
258,22816063-d610-481e-9594-d3b1fe50b094,2023-11-27T13:09:36.047Z,2023-11-27T13:09:36.047Z,approved,2024-11-28,Love my chair!,Not only is the chair beautiful but it is extremely comfortable!,Love my chair!: Not only is the chair beautiful but it is extremely comfortable!,5,1.0,0,0,False,Verve Chair,,//www.branchfurniture.com/products/verve-chair,https://cdn.shopify.com/s/files/1/0124/5662/4187/products/coralherocopy_x280.jpg?v=1652368917,,,,,,0,not mentioned,0,not mentioned,0,not mentioned,0,not mentioned,0,not mentioned,0,not mentioned,0,not mentioned,0,not mentioned,0,not mentioned,0,not mentioned,0,not mentioned,0,not mentioned,1,positive,1,positive,0,not mentioned,0,not mentioned,0,not mentioned,1,positive,0,not mentioned,0,not mentioned
259,a0deba7c-2108-4126-ac91-b5bb160cde56,2023-11-26T20:21:38.580Z,2023-11-26T20:21:38.580Z,approved,2024-11-28,Should have bought this sooner!,"I'm been suffering really bad back pain since working from home more often and didn't want to spend the money on a chair because they're so expensive lately but I was paying the price in lower back pain. the Verve chair is amazing and soo easy to put together. it took my husband all but 5 mins to assemble, even he was impressed. plus it doesn't hurt that its gorgeous to look at as well. it supports my back in all the right places, and rolls so smoothly too","Should have bought this sooner!: I'm been suffering really bad back pain since working from home more often and didn't want to spend the money on a chair because they're so expensive lately but I was paying the price in lower back pain. the Verve chair is amazing and soo easy to put together. it took my husband all but 5 mins to assemble, even he was impressed. plus it doesn't hurt that its gorgeous to look at as well. it supports my back in all the right places, and rolls so smoothly too",5,1.0,0,0,False,Verve Chair,,//www.branchfurniture.com/products/verve-chair,https://cdn.shopify.com/s/files/1/0124/5662/4187/products/coralherocopy_x280.jpg?v=1652368917,,,,,"[{'largePortraitThumbnailUrl': '//d4yxl4pe8dqlj.cloudfront.net/images/49d51961-337e-46f0-96d6-e89d05286d60/09873960-5681-4339-b528-308e2ec31b79_thumbnail_portrait_large.jpg', 'streamId': '09873960-5681-4339-b528-308e2ec31b79', 'fullSizeUrl': '//d4yxl4pe8dqlj.cloudfront.net/images/49d51961-337e-46f0-96d6-e89d05286d60/09873960-5681-4339-b528-308e2ec31b79_full_size.jpg', 'largeUrl': '//d4yxl4pe8dqlj.cloudfront.net/images/49d51961-337e-46f0-96d6-e89d05286d60/09873960-5681-4339-b528-308e2ec31b79_large.jpg', 'type': 'image', 'dynamicKey': '49d51961-337e-46f0-96d6-e89d05286d60/09873960-5681-4339-b528-308e2ec31b79', 'thumbnailUrl': '//d4yxl4pe8dqlj.cloudfront.net/images/49d51961-337e-46f0-96d6-e89d05286d60/09873960-5681-4339-b528-308e2ec31b79_thumbnail_120_120.jpg'}]",0,not mentioned,0,not mentioned,0,not mentioned,1,positive,0,not mentioned,1,positive,0,not mentioned,0,not mentioned,0,not mentioned,1,positive,0,not mentioned,1,positive,1,positive,1,positive,0,not mentioned,0,not mentioned,0,not mentioned,1,positive,0,not mentioned,1,positive
