573,2a30bf27-5b47-4089-becd-a59bb0d00643,2023-12-07T19:54:25.333Z,2023-12-07T19:54:25.333Z,approved,2024-11-28,4 Stars,"It’s comfy! The only downside is I’m 5’3 and can barely touch the ground on the lowest setting. It’s also more pink than coral, but over all I still love it.","4 Stars: It’s comfy! The only downside is I’m 5’3 and can barely touch the ground on the lowest setting. It’s also more pink than coral, but over all I still love it.",4,1.0,0,0,False,Verve Chair,,//www.branchfurniture.com/products/verve-chair,https://cdn.shopify.com/s/files/1/0124/5662/4187/products/coralherocopy_x280.jpg?v=1652368917,,,,,,1,negative,1,neutral,0,not mentioned,1,positive,0,not mentioned,1,positive,1,positive,0,not mentioned,0,not mentioned,0,not mentioned,0,not mentioned,0,not mentioned,0,not mentioned,1,positive,0,not mentioned,0,not mentioned,1,negative,1,positive,0,not mentioned,0,not mentioned
574,7c31a88c-b6b2-45a7-92ea-b6f7fdb0a3f4,2023-12-07T19:54:25.000Z,2023-12-07T19:54:25.000Z,approved,2024-11-28,4 Stars,"It’s comfy! The only downside is I’m 5’3 and can barely touch the ground on the lowest setting. It’s also more pink than coral, but over all I still love it.
","4 Stars: It’s comfy! The only downside is I’m 5’3 and can barely touch the ground on the lowest setting. It’s also more pink than coral, but over all I still love it.
",4,1.0,0,0,False,Verve Chair,Coral / Standard,//www.branchfurniture.com/products/verve-chair,https://cdn.shopify.com/s/files/1/0124/5662/4187/files/20220513_VerveChair_FrontPersp_Coral_x280.jpg?v=1695306444,39633980293155,,,,,1,negative,1,neutral,0,not mentioned,1,positive,0,not mentioned,1,positive,1,positive,0,not mentioned,0,not mentioned,0,not mentioned,0,not mentioned,0,not mentioned,0,not mentioned,1,positive,0,not mentioned,0,not mentioned,0,not mentioned,1,positive,0,not mentioned,0,not mentioned
575,1d7696a5-4840-44e0-ae76-14559ab7343c,2023-12-07T19:37:59.133Z,2023-12-07T19:37:59.133Z,approved,2024-11-28,4 Stars,Love the comfort and mobility of this chair. The price is a little high for not having a optional headrest. Everything else is great.,4 Stars: Love the comfort and mobility of this chair. The price is a little high for not having a optional headrest. Everything else is great.,4,1.0,0,0,False,Verve Chair,,//www.branchfurniture.com/products/verve-chair,https://cdn.shopify.com/s/files/1/0124/5662/4187/products/coralherocopy_x280.jpg?v=1652368917,,,,,,0,not mentioned,0,not mentioned,1,negative,1,positive,0,not mentioned,1,negative,1,positive,0,not mentioned,0,not mentioned,0,not mentioned,0,not mentioned,0,not mentioned,0,not mentioned,1,positive,0,not mentioned,0,not mentioned,0,not mentioned,0,not mentioned,0,not mentioned,0,not mentioned
576,0cdc2d93-b25d-45c0-949e-54fefbeb2f63,2023-12-03T03:01:22.127Z,2023-12-03T03:01:22.127Z,approved,2024-11-28,Great Chair!,"I was skeptical of buying the chair simply from reviews without being able to sit on it, or see it in person. However, I am in love with my chair now that it is physically here! I cannot say enough positive things about how comfortable the chair, and I felt like my lower back pain/tightness immediately disappeared when I sat in this chair. My only complaint is that Armrests for the chair do not lock in at different heights completely so sometimes when I am working my arm rests just fall all the way to lowest settings, and it can be jarring/annoying. I still recommend this chair though!","Great Chair!: I was skeptical of buying the chair simply from reviews without being able to sit on it, or see it in person. However, I am in love with my chair now that it is physically here! I cannot say enough positive things about how comfortable the chair, and I felt like my lower back pain/tightness immediately disappeared when I sat in this chair. My only complaint is that Armrests for the chair do not lock in at different heights completely so sometimes when I am working my arm rests just fall all the way to lowest settings, and it can be jarring/annoying. I still recommend this chair though!",4,1.0,0,0,False,Verve Chair,,//www.branchfurniture.com/products/verve-chair,https://cdn.shopify.com/s/files/1/0124/5662/4187/products/coralherocopy_x280.jpg?v=1652368917,,,,,,0,not mentioned,1,negative,1,negative,1,positive,0,not mentioned,1,positive,1,positive,0,not mentioned,0,not mentioned,0,not mentioned,0,not mentioned,1,positive,0,not mentioned,1,positive,0,not mentioned,0,not mentioned,0,not mentioned,0,not mentioned,0,not mentioned,0,not mentioned
577,956f6c8f-50c1-4e74-ac2c-4bb3e453ee07,2023-11-24T17:29:17.117Z,2023-11-24T17:29:17.117Z,approved,2024-11-28,4 Stars,"The chair is very cute, and I love how it looks, which was the main reason I picked it over other cheaper chairs. It’s comfortable, and I like all the adjustment options. Like others have said tho, the arm rest adjustment mechanism is so flimsy. Also the lumbar support always slides down, and I have to readjust it every time I sit down. Overall though, it looks great, is comfy, has a lot of adjustments, but is just pricey for what it is.","4 Stars: The chair is very cute, and I love how it looks, which was the main reason I picked it over other cheaper chairs. It’s comfortable, and I like all the adjustment options. Like others have said tho, the arm rest adjustment mechanism is so flimsy. Also the lumbar support always slides down, and I have to readjust it every time I sit down. Overall though, it looks great, is comfy, has a lot of adjustments, but is just pricey for what it is.",4,1.0,0,0,False,Verve Chair,,//www.branchfurniture.com/products/verve-chair,https://cdn.shopify.com/s/files/1/0124/5662/4187/products/coralherocopy_x280.jpg?v=1652368917,,,,,,1,positive,1,positive,1,negative,1,neutral,0,not mentioned,1,negative,0,not mentioned,0,not mentioned,0,not mentioned,0,not mentioned,0,not mentioned,1,negative,1,positive,1,positive,0,not mentioned,0,not mentioned,0,not mentioned,1,positive,0,not mentioned,0,not mentioned
578,7b51a695-0fdb-42ad-aa1d-ff7a331e3728,2023-11-24T17:29:17.000Z,2023-11-24T17:29:17.000Z,approved,2024-11-28,4 Stars,"The chair is very cute, and I love how it looks, which was the main reason I picked it over other cheaper chairs. It’s comfortable, and I like all the adjustment options. Like others have said tho, the arm rest adjustment mechanism is so flimsy. Also the lumbar support always slides down, and I have to readjust it every time I sit down. Overall though, it looks great, is comfy, has a lot of adjustments, but is just pricey for what it is.","4 Stars: The chair is very cute, and I love how it looks, which was the main reason I picked it over other cheaper chairs. It’s comfortable, and I like all the adjustment options. Like others have said tho, the arm rest adjustment mechanism is so flimsy. Also the lumbar support always slides down, and I have to readjust it every time I sit down. Overall though, it looks great, is comfy, has a lot of adjustments, but is just pricey for what it is.",4,1.0,0,0,False,Verve Chair,Mist / Standard,//www.branchfurniture.com/products/verve-chair,https://cdn.shopify.com/s/files/1/0124/5662/4187/files/20220513_VerveChair_FrontPersp_Mist_x280.jpg?v=1695306444,39633980325923,,,,,0,not mentioned,1,positive,1,negative,1,negative,0,not mentioned,1,negative,0,not mentioned,0,not mentioned,0,not mentioned,0,not mentioned,0,not mentioned,1,negative,0,not mentioned,1,positive,0,not mentioned,0,not mentioned,0,not mentioned,1,positive,0,not mentioned,0,not mentioned
579,6fbd761e-5fcf-41d5-ab33-12b229ffbb74,2023-11-20T03:18:05.967Z,2023-11-20T03:18:05.967Z,approved,2024-11-28,Finally a beautiful and comfortable chair on the market.,"Hi, I recently moved into a new apartment and adding the Coral Verve chair has brought so much life into the office! I was worried when I read the comments saying that it's not worth the price versus quality, I agree that the arms are annoying and unstable, low quality. Branch should fix this problem ASAP and not ignore the facts - but I still bought because I don't keep adjusting the arms - so it works perfect for me! The wheels are smooth, the chair is comfortable and supports my lower back well. It's hard to find a beautiful office chair that brings joy to your everyday life. So go ahead! You found one! There is nothing perfect, so lower one star to match your expectations. I recommend!","Finally a beautiful and comfortable chair on the market.: Hi, I recently moved into a new apartment and adding the Coral Verve chair has brought so much life into the office! I was worried when I read the comments saying that it's not worth the price versus quality, I agree that the arms are annoying and unstable, low quality. Branch should fix this problem ASAP and not ignore the facts - but I still bought because I don't keep adjusting the arms - so it works perfect for me! The wheels are smooth, the chair is comfortable and supports my lower back well. It's hard to find a beautiful office chair that brings joy to your everyday life. So go ahead! You found one! There is nothing perfect, so lower one star to match your expectations. I recommend!",4,1.0,0,0,False,Verve Chair,,//www.branchfurniture.com/products/verve-chair,https://cdn.shopify.com/s/files/1/0124/5662/4187/products/coralherocopy_x280.jpg?v=1652368917,,,,,,0,not mentioned,0,not mentioned,1,negative,1,positive,0,not mentioned,1,positive,1,positive,0,not mentioned,0,not mentioned,0,not mentioned,0,not mentioned,1,positive,1,negative,1,positive,0,not mentioned,0,not mentioned,0,not mentioned,1,positive,0,not mentioned,1,positive
580,5f56b18e-8816-413c-bc3e-e6062e847102,2023-11-17T19:25:48.180Z,2023-11-17T19:25:48.180Z,approved,2024-11-28,Comfortable Office Chair,"I am enjoying my new Verve office chair from Branch. I could personally use slightly more lumbar support, and I wish I had also ordered the attachable neck support - I may still order it. This comfortable chair is easy to put together and adjust based on personal requirements.","Comfortable Office Chair: I am enjoying my new Verve office chair from Branch. I could personally use slightly more lumbar support, and I wish I had also ordered the attachable neck support - I may still order it. This comfortable chair is easy to put together and adjust based on personal requirements.",4,1.0,0,0,False,Verve Chair,,//www.branchfurniture.com/products/verve-chair,https://cdn.shopify.com/s/files/1/0124/5662/4187/products/coralherocopy_x280.jpg?v=1652368917,,,,,,1,positive,1,positive,1,negative,1,neutral,0,not mentioned,0,not mentioned,0,not mentioned,0,not mentioned,0,not mentioned,1,positive,0,not mentioned,1,negative,0,not mentioned,1,positive,0,not mentioned,0,not mentioned,0,not mentioned,0,not mentioned,0,not mentioned,0,not mentioned
581,e1f4e07c-8133-4a10-8a1b-5d146945e25e,2023-10-31T18:24:19.253Z,2023-10-31T18:24:19.253Z,approved,2024-11-28,"Comfortable, solid and well-made office chair (if you are the right size)","I am very happy with the Verve chair, however, it could really use about 6 more inches of height adjustment. I would love to give it 5 stars but even at the highest setting it is too low for my frame. It's disappointing because I like everything else about the chair.","Comfortable, solid and well-made office chair (if you are the right size): I am very happy with the Verve chair, however, it could really use about 6 more inches of height adjustment. I would love to give it 5 stars but even at the highest setting it is too low for my frame. It's disappointing because I like everything else about the chair.",4,1.0,0,0,False,Verve Chair,,//www.branchfurniture.com/products/verve-chair,https://cdn.shopify.com/s/files/1/0124/5662/4187/products/coralherocopy_x280.jpg?v=1652368917,,,,,,1,negative,1,negative,0,not mentioned,0,not mentioned,0,not mentioned,1,positive,1,positive,0,not mentioned,0,not mentioned,0,not mentioned,0,not mentioned,0,not mentioned,1,positive,1,positive,0,not mentioned,0,not mentioned,1,negative,1,positive,0,not mentioned,0,not mentioned
582,1b871b17-5a64-40f5-b4d8-481157a363d2,2023-10-16T13:22:44.673Z,2023-10-16T13:22:44.673Z,approved,2024-11-28,Great Chair,"This is a great chair for me! This is no small thing as I often feel like one of the bears in Goldilocks and the Three Bears...""The first chair was too hard, the second too soft, but the third was just right"". I have tried other more expensive brands but this chair works much better for me. The only thing I don't love are the arms. I find them too short and wish I could adjust them forward. Also, the locking mechanism takes some getting used to.","Great Chair: This is a great chair for me! This is no small thing as I often feel like one of the bears in Goldilocks and the Three Bears...""The first chair was too hard, the second too soft, but the third was just right"". I have tried other more expensive brands but this chair works much better for me. The only thing I don't love are the arms. I find them too short and wish I could adjust them forward. Also, the locking mechanism takes some getting used to.",4,1.0,0,0,False,Verve Chair,,//www.branchfurniture.com/products/verve-chair,https://cdn.shopify.com/s/files/1/0124/5662/4187/products/coralherocopy_x280.jpg?v=1652368917,,,,,,1,positive,1,neutral,1,negative,1,positive,1,positive,1,positive,1,positive,0,not mentioned,0,not mentioned,0,not mentioned,0,not mentioned,1,positive,1,positive,1,positive,0,not mentioned,0,not mentioned,0,not mentioned,1,positive,0,not mentioned,0,not mentioned
583,2d854aae-1c0c-4a6b-89c1-0248adf6516d,2023-10-12T20:04:03.387Z,2023-10-12T20:04:03.387Z,approved,2024-11-28,Wish I had this chair a year ago,"It's so comfortable, I love this chair and would buy it again in a heartbeat. The one issue with it is I wish the seat could lift an inch or two higher. It's so close to being perfect.","Wish I had this chair a year ago: It's so comfortable, I love this chair and would buy it again in a heartbeat. The one issue with it is I wish the seat could lift an inch or two higher. It's so close to being perfect.",4,1.0,0,0,False,Verve Chair,,//www.branchfurniture.com/products/verve-chair,https://cdn.shopify.com/s/files/1/0124/5662/4187/products/coralherocopy_x280.jpg?v=1652368917,,,,,,0,not mentioned,1,negative,0,not mentioned,1,positive,0,not mentioned,1,positive,1,positive,0,not mentioned,0,not mentioned,0,not mentioned,0,not mentioned,1,positive,1,positive,1,positive,0,not mentioned,0,not mentioned,0,not mentioned,0,not mentioned,0,not mentioned,0,not mentioned
584,76bf4aa6-167e-4a04-bace-4b909500d107,2023-09-18T19:02:44.800Z,2023-09-18T19:02:44.800Z,approved,2024-11-28,4 Stars,I've used the chair for about a week now. It was easy to assemble and pretty comfortable. If I could adjust two things it would be that the chair post fits more snuggly in the roller piece to reduce wobble. I also sit pretty straight so it would be nice if the back came a little further forward or was a little taller. Overall I do really enjoy the chair.,4 Stars: I've used the chair for about a week now. It was easy to assemble and pretty comfortable. If I could adjust two things it would be that the chair post fits more snuggly in the roller piece to reduce wobble. I also sit pretty straight so it would be nice if the back came a little further forward or was a little taller. Overall I do really enjoy the chair.,4,1.0,0,0,False,Verve Chair,,//www.branchfurniture.com/products/verve-chair,https://cdn.shopify.com/s/files/1/0124/5662/4187/products/coralherocopy_x280.jpg?v=1652368917,,,,,,0,not mentioned,1,positive,0,not mentioned,1,neutral,0,not mentioned,1,positive,1,positive,0,not mentioned,0,not mentioned,1,positive,0,not mentioned,0,not mentioned,0,not mentioned,1,positive,0,not mentioned,0,not mentioned,0,not mentioned,0,not mentioned,0,not mentioned,0,not mentioned
585,eadbf2cd-c70c-4d5a-94a7-81181cb2e26c,2023-09-12T19:55:31.633Z,2023-09-12T19:55:31.633Z,approved,2024-11-28,"Good, odd arm adjustments.","The chair is good for the price, maybe slightly overpriced. Might expect it to come assembled. It is comfortable, provides good support, didn’t fatigue my core over multiple hours. Important to note that the backrest of the chair is a cloth mesh material, not a plastic. The arm rests are my only point of contention. In order to adjust, you pull them up, however you can’t move them down without pulling them to the max height and then starting from the lowest position again. In order to find your preferred height, you’ll have to count in your head how many “clicks” there are before reaching the top, and then moving to the one you liked the most. Basically, the arm rest height adjustment is not two ways. I bought this for my girlfriend, so I will use her height. She had the same opinions. Overall, satisfied.","Good, odd arm adjustments.: The chair is good for the price, maybe slightly overpriced. Might expect it to come assembled. It is comfortable, provides good support, didn’t fatigue my core over multiple hours. Important to note that the backrest of the chair is a cloth mesh material, not a plastic. The arm rests are my only point of contention. In order to adjust, you pull them up, however you can’t move them down without pulling them to the max height and then starting from the lowest position again. In order to find your preferred height, you’ll have to count in your head how many “clicks” there are before reaching the top, and then moving to the one you liked the most. Basically, the arm rest height adjustment is not two ways. I bought this for my girlfriend, so I will use her height. She had the same opinions. Overall, satisfied.",4,1.0,0,0,False,Verve Chair,,//www.branchfurniture.com/products/verve-chair,https://cdn.shopify.com/s/files/1/0124/5662/4187/products/coralherocopy_x280.jpg?v=1652368917,,,,,,1,positive,1,negative,1,negative,1,positive,0,not mentioned,1,positive,1,positive,0,not mentioned,0,not mentioned,0,not mentioned,0,not mentioned,1,positive,1,positive,1,positive,0,not mentioned,0,not mentioned,0,not mentioned,0,not mentioned,0,not mentioned,0,not mentioned
586,1c077745-e708-413c-b357-fd2406ab1059,2023-09-07T18:02:38.920Z,2023-09-07T18:02:38.920Z,approved,2024-11-28,Branch Verve chair,"Very happy with the chair overall.
The arms could be improved - would like them wider, better fabric/cushioning and more adjustability.","Branch Verve chair: Very happy with the chair overall.
The arms could be improved - would like them wider, better fabric/cushioning and more adjustability.",4,1.0,0,0,False,Verve Chair,,//www.branchfurniture.com/products/verve-chair,https://cdn.shopify.com/s/files/1/0124/5662/4187/products/coralherocopy_x280.jpg?v=1652368917,,,,,,0,not mentioned,1,neutral,1,negative,0,not mentioned,0,not mentioned,1,positive,1,positive,0,not mentioned,0,not mentioned,0,not mentioned,0,not mentioned,0,not mentioned,0,not mentioned,0,not mentioned,0,not mentioned,0,not mentioned,0,not mentioned,0,not mentioned,0,not mentioned,0,not mentioned
587,cfdcc493-a763-4f7e-ba90-8e22ae57c371,2023-08-14T19:09:11.760Z,2023-08-14T19:09:11.760Z,approved,2024-11-28,So far good,"Overall good.
Cons: 1. Product was not delivered to the door. 
 2. Handle is hard to hold on a fixed height
 3. Seat is a little tilted downwards","So far good: Overall good.
Cons: 1. Product was not delivered to the door. 
 2. Handle is hard to hold on a fixed height
 3. Seat is a little tilted downwards",4,1.0,0,0,False,Verve Chair,,//www.branchfurniture.com/products/verve-chair,https://cdn.shopify.com/s/files/1/0124/5662/4187/products/coralherocopy_x280.jpg?v=1652368917,,,,,,0,not mentioned,0,not mentioned,0,not mentioned,0,not mentioned,0,not mentioned,0,not mentioned,0,not mentioned,0,not mentioned,1,negative,0,not mentioned,0,not mentioned,0,not mentioned,0,not mentioned,0,not mentioned,0,not mentioned,1,negative,0,not mentioned,0,not mentioned,0,not mentioned,0,not mentioned
588,f43632bd-ec35-4bad-909c-2db398f315b2,2023-07-28T18:34:47.310Z,2023-07-28T18:34:47.310Z,approved,2024-11-28,Recommended,"I like it overall. It has nice features and the design looks great in my room. My only comment is the lowest height. As a 5’2”, it could go a bit lower than how it designed right now.","Recommended: I like it overall. It has nice features and the design looks great in my room. My only comment is the lowest height. As a 5’2”, it could go a bit lower than how it designed right now.",4,1.0,0,0,False,Verve Chair,,//www.branchfurniture.com/products/verve-chair,https://cdn.shopify.com/s/files/1/0124/5662/4187/products/coralherocopy_x280.jpg?v=1652368917,,,,,,1,neutral,0,not mentioned,0,not mentioned,0,not mentioned,0,not mentioned,1,positive,1,positive,0,not mentioned,0,not mentioned,0,not mentioned,0,not mentioned,0,not mentioned,1,positive,0,not mentioned,1,negative,0,not mentioned,0,not mentioned,1,positive,0,not mentioned,0,not mentioned
589,bf339570-6820-435a-af83-563d0d0fbc6b,2023-07-27T19:53:58.620Z,2023-07-27T19:53:58.620Z,approved,2024-11-28,Such an upgrade,I work from home and finally upgraded to a real desk chair. My body feels so much better at the end of the day. It was easy to assemble and feels like it will last a long time. Only complaint is the arms are a little wiggly.,Such an upgrade: I work from home and finally upgraded to a real desk chair. My body feels so much better at the end of the day. It was easy to assemble and feels like it will last a long time. Only complaint is the arms are a little wiggly.,4,1.0,0,0,False,Verve Chair,,//www.branchfurniture.com/products/verve-chair,https://cdn.shopify.com/s/files/1/0124/5662/4187/products/coralherocopy_x280.jpg?v=1652368917,,,,,,1,positive,1,positive,1,negative,1,positive,0,not mentioned,1,positive,0,not mentioned,0,not mentioned,0,not mentioned,1,positive,1,positive,1,positive,1,positive,1,positive,0,not mentioned,0,not mentioned,0,not mentioned,0,not mentioned,0,not mentioned,0,not mentioned
590,37eca0c4-706c-4bed-b48c-27b12ac69009,2023-07-23T20:34:20.987Z,2023-07-23T20:34:20.987Z,approved,2024-11-28,Very Comfortable chair,"This is a very high-quality chair. The weight of it feels solid and it really supports me. I love all the adjustments - especially being able to change the seat depth. I did not attach the arms of this chair because it allows me to get closer to my desk (I have short arms). I would have loved the option to buy this chair without arms at a lower price (I've seen this with other manufacturers), but that's the only reason for I didn't give this a 5 star.","Very Comfortable chair: This is a very high-quality chair. The weight of it feels solid and it really supports me. I love all the adjustments - especially being able to change the seat depth. I did not attach the arms of this chair because it allows me to get closer to my desk (I have short arms). I would have loved the option to buy this chair without arms at a lower price (I've seen this with other manufacturers), but that's the only reason for I didn't give this a 5 star.",4,1.0,0,0,False,Verve Chair,,//www.branchfurniture.com/products/verve-chair,https://cdn.shopify.com/s/files/1/0124/5662/4187/products/coralherocopy_x280.jpg?v=1652368917,,,,,,1,positive,1,positive,1,negative,1,neutral,0,not mentioned,1,positive,0,not mentioned,0,not mentioned,0,not mentioned,0,not mentioned,0,not mentioned,0,not mentioned,1,positive,1,positive,1,positive,0,not mentioned,0,not mentioned,0,not mentioned,0,not mentioned,0,not mentioned
591,fb5ed061-4913-4fcb-b1af-98e8c473125c,2023-07-21T02:14:19.550Z,2023-07-21T02:14:19.550Z,approved,2024-11-28,great chair if you aren't tall,"if you're tall, the highest the lumbar support can adjust to still cannot go high enough to reach the small of my back, which is where it should rest. as a result, the lumbar support is essentially useless. otherwise satisifed","great chair if you aren't tall: if you're tall, the highest the lumbar support can adjust to still cannot go high enough to reach the small of my back, which is where it should rest. as a result, the lumbar support is essentially useless. otherwise satisifed",4,1.0,0,0,False,Verve Chair,,//www.branchfurniture.com/products/verve-chair,https://cdn.shopify.com/s/files/1/0124/5662/4187/products/coralherocopy_x280.jpg?v=1652368917,,,,,,1,negative,1,negative,0,not mentioned,1,negative,0,not mentioned,1,neutral,1,neutral,0,not mentioned,0,not mentioned,0,not mentioned,0,not mentioned,1,negative,0,not mentioned,1,negative,1,negative,0,not mentioned,1,negative,0,not mentioned,0,not mentioned,0,not mentioned
592,effdbe0b-ab3f-4fb8-be7e-992c7e35000a,2023-07-03T06:45:32.960Z,2023-07-03T06:45:32.960Z,approved,2024-11-28,4 Stars,"The chair is very comfortable, stylish, and the height is easily interchangeable between kids and myself. I do wish armrests were a little more substantial and they seem to fall down easily. Otherwise, we have been happy with the chair and feel it is durable.","4 Stars: The chair is very comfortable, stylish, and the height is easily interchangeable between kids and myself. I do wish armrests were a little more substantial and they seem to fall down easily. Otherwise, we have been happy with the chair and feel it is durable.",4,1.0,0,0,False,Verve Chair,,//www.branchfurniture.com/products/verve-chair,https://cdn.shopify.com/s/files/1/0124/5662/4187/products/coralherocopy_x280.jpg?v=1652368917,,,,,,1,positive,1,positive,1,negative,1,neutral,0,not mentioned,1,positive,1,positive,0,not mentioned,0,not mentioned,0,not mentioned,1,positive,0,not mentioned,1,positive,1,positive,0,not mentioned,0,not mentioned,0,not mentioned,1,positive,0,not mentioned,0,not mentioned
