2023-12-07T20:15:01.950Z,2023-12-07T20:15:01.950Z,approved,2024-11-28,5 Stars,One of the most comfortable chairs I own for work. I’ve used many ergonomic chairs in the past and this one has become my favorite. Also the coral color. 🔥,5 Stars: One of the most comfortable chairs I own for work. I’ve used many ergonomic chairs in the past and this one has become my favorite. Also the coral color. 🔥,5,1.0,0,0,False,Verve Chair,,//www.branchfurniture.com/products/verve-chair,https://cdn.shopify.com/s/files/1/0124/5662/4187/products/coralherocopy_x280.jpg?v=1652368917,,,,,0,not mentioned,0,not mentioned,0,not mentioned,0,not mentioned,0,not mentioned,1,positive,1,positive,0,not mentioned,0,not mentioned,0,not mentioned,0,not mentioned,0,not mentioned,0,not mentioned,1,positive,0,not mentioned,0,not mentioned,0,not mentioned,1,positive,0,not mentioned,0,not mentioned
2023-12-07T20:15:01.000Z,2023-12-07T20:15:01.000Z,approved,2024-11-28,5 Stars,One of the most comfortable chairs I own for work. I’ve used many ergonomic chairs in the past and this one has become my favorite. Also the coral color. 🔥,5 Stars: One of the most comfortable chairs I own for work. I’ve used many ergonomic chairs in the past and this one has become my favorite. Also the coral color. 🔥,5,1.0,0,0,False,Verve Chair,Coral / Standard,//www.branchfurniture.com/products/verve-chair,https://cdn.shopify.com/s/files/1/0124/5662/4187/files/20220513_VerveChair_FrontPersp_Coral_x280.jpg?v=1695306444,39633980293155,,,,0,not mentioned,0,not mentioned,0,not mentioned,0,not mentioned,0,not mentioned,1,positive,1,positive,0,not mentioned,0,not mentioned,0,not mentioned,0,not mentioned,0,not mentioned,0,not mentioned,1,positive,0,not mentioned,0,not mentioned,0,not mentioned,1,positive,0,not mentioned,0,not mentioned
2023-12-07T20:14:18.897Z,2023-12-07T20:14:18.897Z,approved,2024-11-28,5 Stars,Chair came without the star base but Branch sent the piece immediately and now the chair is complete and really enjoyable,5 Stars: Chair came without the star base but Branch sent the piece immediately and now the chair is complete and really enjoyable,5,1.0,0,0,False,Verve Chair,,//www.branchfurniture.com/products/verve-chair,https://cdn.shopify.com/s/files/1/0124/5662/4187/products/coralherocopy_x280.jpg?v=1652368917,,,,,0,not mentioned,0,not mentioned,0,not mentioned,0,not mentioned,0,not mentioned,1,positive,1,positive,1,positive,1,positive,0,not mentioned,0,not mentioned,0,not mentioned,0,not mentioned,1,positive,0,not mentioned,0,not mentioned,0,not mentioned,0,not mentioned,0,not mentioned,0,not mentioned
2023-12-07T20:10:04.447Z,2023-12-07T20:10:04.447Z,approved,2024-11-28,5 Stars,I was thoroughly impressed by the construction and materials in this chair. And I love the color (cobalt). I feel like this was money well spent.,5 Stars: I was thoroughly impressed by the construction and materials in this chair. And I love the color (cobalt). I feel like this was money well spent.,5,1.0,0,0,False,Verve Chair,,//www.branchfurniture.com/products/verve-chair,https://cdn.shopify.com/s/files/1/0124/5662/4187/products/coralherocopy_x280.jpg?v=1652368917,,,,,0,not mentioned,0,not mentioned,0,not mentioned,0,not mentioned,0,not mentioned,1,positive,0,not mentioned,0,not mentioned,0,not mentioned,0,not mentioned,0,not mentioned,0,not mentioned,1,positive,0,not mentioned,0,not mentioned,0,not mentioned,0,not mentioned,1,positive,0,not mentioned,0,not mentioned
2023-12-07T20:10:04.000Z,2023-12-07T20:10:04.000Z,approved,2024-11-28,5 Stars,"I was thoroughly impressed by the construction and materials in this chair. And I love the color (cobalt). I feel like this was money well spent.
","5 Stars: I was thoroughly impressed by the construction and materials in this chair. And I love the color (cobalt). I feel like this was money well spent.
",5,1.0,0,0,False,Verve Chair,Cobalt / Standard,//www.branchfurniture.com/products/verve-chair,https://cdn.shopify.com/s/files/1/0124/5662/4187/files/verve-monochrome-cobalt-1_x280.jpg?v=1730233506,39973033771043,,,,0,not mentioned,0,not mentioned,0,not mentioned,0,not mentioned,0,not mentioned,1,positive,0,not mentioned,0,not mentioned,0,not mentioned,0,not mentioned,0,not mentioned,0,not mentioned,1,positive,0,not mentioned,0,not mentioned,0,not mentioned,0,not mentioned,1,positive,0,not mentioned,0,not mentioned
2023-12-07T20:09:00.327Z,2023-12-07T20:09:00.327Z,approved,2024-11-28,5 Stars,Love the chair. Very comfortable and I can sit on it all day for work,5 Stars: Love the chair. Very comfortable and I can sit on it all day for work,5,1.0,0,0,False,Verve Chair,,//www.branchfurniture.com/products/verve-chair,https://cdn.shopify.com/s/files/1/0124/5662/4187/products/coralherocopy_x280.jpg?v=1652368917,,,,,0,not mentioned,0,not mentioned,0,not mentioned,0,not mentioned,0,not mentioned,1,positive,1,positive,0,not mentioned,0,not mentioned,0,not mentioned,0,not mentioned,0,not mentioned,0,not mentioned,1,positive,0,not mentioned,0,not mentioned,0,not mentioned,0,not mentioned,0,not mentioned,0,not mentioned
2023-12-07T20:07:06.763Z,2023-12-07T20:07:06.763Z,approved,2024-11-28,5 Stars,It is a sturdy and beautiful chair. Very comfortable and easy to assemble.,5 Stars: It is a sturdy and beautiful chair. Very comfortable and easy to assemble.,5,1.0,0,0,False,Verve Chair,,//www.branchfurniture.com/products/verve-chair,https://cdn.shopify.com/s/files/1/0124/5662/4187/products/coralherocopy_x280.jpg?v=1652368917,,,,,0,not mentioned,0,not mentioned,0,not mentioned,0,not mentioned,0,not mentioned,1,positive,0,not mentioned,0,not mentioned,0,not mentioned,1,positive,0,not mentioned,0,not mentioned,1,positive,1,positive,0,not mentioned,0,not mentioned,0,not mentioned,1,positive,0,not mentioned,0,not mentioned
2023-12-07T20:07:06.000Z,2023-12-07T20:07:06.000Z,approved,2024-11-28,5 Stars,It is a sturdy and beautiful chair. Very comfortable and easy to assemble. ,5 Stars: It is a sturdy and beautiful chair. Very comfortable and easy to assemble. ,5,1.0,0,0,False,Verve Chair,Coral / Standard,//www.branchfurniture.com/products/verve-chair,https://cdn.shopify.com/s/files/1/0124/5662/4187/files/20220513_VerveChair_FrontPersp_Coral_x280.jpg?v=1695306444,39633980293155,,,,0,not mentioned,0,not mentioned,0,not mentioned,0,not mentioned,0,not mentioned,1,positive,0,not mentioned,0,not mentioned,0,not mentioned,1,positive,0,not mentioned,0,not mentioned,1,positive,1,positive,0,not mentioned,0,not mentioned,0,not mentioned,1,positive,0,not mentioned,0,not mentioned
2023-12-07T20:03:25.657Z,2023-12-07T20:03:25.657Z,approved,2024-11-28,5 Stars,"Comfortable chair, good support, and looks great!","5 Stars: Comfortable chair, good support, and looks great!",5,1.0,0,0,False,Verve Chair,,//www.branchfurniture.com/products/verve-chair,https://cdn.shopify.com/s/files/1/0124/5662/4187/products/coralherocopy_x280.jpg?v=1652368917,,,,,0,not mentioned,0,not mentioned,0,not mentioned,0,not mentioned,0,not mentioned,1,positive,1,positive,0,not mentioned,0,not mentioned,0,not mentioned,0,not mentioned,1,positive,1,positive,1,positive,0,not mentioned,0,not mentioned,0,not mentioned,1,positive,0,not mentioned,0,not mentioned
2023-12-07T20:01:22.953Z,2023-12-07T20:01:22.953Z,approved,2024-11-28,5 Stars,"absolutely blown away by the build quality, design, and installation procedure for this chair. The milling and heft of the connector pieces is unlike any flat pack product I have ever seen. Even the hex wrench supplied was made to use, so much so I didn’t even bother getting one of mine - definitely not your typical “L” wrench. The fact that branch even throws wrench in two extra bolts (one of each type) is just the sort of thing that costs very little on the front end and can solve enumerable inconvenience down the road. 

Now if the chair was uncomfortable, no one would care about the great design or robust materials, but the fact is at 6’4” I found it a great chair and at 5’4” my wife did to. The chair is for easily adjustable- unlike so many that have tons of levers that have little or no discernible function or one that practically gives you whiplash. my wife does tele-health daily and a quality chair is essential. this chair has put a smile on her face for sure!","5 Stars: absolutely blown away by the build quality, design, and installation procedure for this chair. The milling and heft of the connector pieces is unlike any flat pack product I have ever seen. Even the hex wrench supplied was made to use, so much so I didn’t even bother getting one of mine - definitely not your typical “L” wrench. The fact that branch even throws wrench in two extra bolts (one of each type) is just the sort of thing that costs very little on the front end and can solve enumerable inconvenience down the road. 

Now if the chair was uncomfortable, no one would care about the great design or robust materials, but the fact is at 6’4” I found it a great chair and at 5’4” my wife did to. The chair is for easily adjustable- unlike so many that have tons of levers that have little or no discernible function or one that practically gives you whiplash. my wife does tele-health daily and a quality chair is essential. this chair has put a smile on her face for sure!",5,1.0,0,0,False,Verve Chair,,//www.branchfurniture.com/products/verve-chair,https://cdn.shopify.com/s/files/1/0124/5662/4187/products/coralherocopy_x280.jpg?v=1652368917,,,,,1,positive,1,positive,0,not mentioned,0,not mentioned,0,not mentioned,1,positive,1,positive,1,positive,0,not mentioned,1,positive,0,not mentioned,0,not mentioned,1,positive,1,positive,0,not mentioned,0,not mentioned,1,positive,1,positive,0,not mentioned,0,not mentioned
2023-12-07T20:01:22.000Z,2023-12-07T20:01:22.000Z,approved,2024-11-28,5 Stars,"absolutely blown away by the build quality, design, and installation procedure for this chair. The milling and heft of the connector pieces is unlike any flat pack product I have ever seen. Even the hex wrench supplied was made to use, so much so I didn’t even bother getting one of mine - definitely not your typical “L” wrench. The fact that branch even throws wrench in two extra bolts (one of each type) is just the sort of thing that costs very little on the front end and can solve enumerable inconvenience down the road. 

Now if the chair was uncomfortable, no one would care about the great design or robust materials, but the fact is at 6’4” I found it a great chair and at 5’4” my wife did to. The chair is for easily adjustable- unlike so many that have tons of levers that have little or no discernible function or one that practically gives you whiplash. my wife does tele-health daily and a quality chair is essential. this chair has put a smile on her face for sure!","5 Stars: absolutely blown away by the build quality, design, and installation procedure for this chair. The milling and heft of the connector pieces is unlike any flat pack product I have ever seen. Even the hex wrench supplied was made to use, so much so I didn’t even bother getting one of mine - definitely not your typical “L” wrench. The fact that branch even throws wrench in two extra bolts (one of each type) is just the sort of thing that costs very little on the front end and can solve enumerable inconvenience down the road. 

Now if the chair was uncomfortable, no one would care about the great design or robust materials, but the fact is at 6’4” I found it a great chair and at 5’4” my wife did to. The chair is for easily adjustable- unlike so many that have tons of levers that have little or no discernible function or one that practically gives you whiplash. my wife does tele-health daily and a quality chair is essential. this chair has put a smile on her face for sure!",5,1.0,0,0,False,Verve Chair,Mist / Standard,//www.branchfurniture.com/products/verve-chair,https://cdn.shopify.com/s/files/1/0124/5662/4187/files/20220513_VerveChair_FrontPersp_Mist_x280.jpg?v=1695306444,39633980325923,,,,1,positive,1,positive,0,not mentioned,0,not mentioned,0,not mentioned,1,positive,1,positive,1,positive,0,not mentioned,1,positive,0,not mentioned,0,not mentioned,1,positive,1,positive,0,not mentioned,0,not mentioned,1,positive,1,positive,0,not mentioned,0,not mentioned
2023-12-07T19:56:14.987Z,2023-12-07T19:56:14.987Z,approved,2024-11-28,5 Stars,Good chair. Nice looking,5 Stars: Good chair. Nice looking,5,1.0,0,0,False,Verve Chair,,//www.branchfurniture.com/products/verve-chair,https://cdn.shopify.com/s/files/1/0124/5662/4187/products/coralherocopy_x280.jpg?v=1652368917,,,,,0,not mentioned,0,not mentioned,0,not mentioned,0,not mentioned,0,not mentioned,0,not mentioned,0,not mentioned,0,not mentioned,0,not mentioned,0,not mentioned,0,not mentioned,0,not mentioned,0,not mentioned,0,not mentioned,0,not mentioned,0,not mentioned,0,not mentioned,1,positive,0,not mentioned,0,not mentioned
2023-12-07T19:56:14.000Z,2023-12-07T19:56:14.000Z,approved,2024-11-28,5 Stars,Good chair. Nice looking ,5 Stars: Good chair. Nice looking ,5,1.0,0,0,False,Verve Chair,Mist / Standard,//www.branchfurniture.com/products/verve-chair,https://cdn.shopify.com/s/files/1/0124/5662/4187/files/20220513_VerveChair_FrontPersp_Mist_x280.jpg?v=1695306444,39633980325923,,,,0,not mentioned,0,not mentioned,0,not mentioned,0,not mentioned,0,not mentioned,0,not mentioned,0,not mentioned,0,not mentioned,0,not mentioned,0,not mentioned,0,not mentioned,0,not mentioned,0,not mentioned,0,not mentioned,0,not mentioned,0,not mentioned,0,not mentioned,1,positive,0,not mentioned,0,not mentioned
2023-12-07T19:54:24.067Z,2023-12-07T19:54:24.067Z,approved,2024-11-28,5 Stars,The chair is amazing,5 Stars: The chair is amazing,5,1.0,0,0,False,Verve Chair,,//www.branchfurniture.com/products/verve-chair,https://cdn.shopify.com/s/files/1/0124/5662/4187/products/coralherocopy_x280.jpg?v=1652368917,,,,,0,not mentioned,0,not mentioned,0,not mentioned,0,not mentioned,0,not mentioned,0,not mentioned,0,not mentioned,0,not mentioned,0,not mentioned,0,not mentioned,0,not mentioned,0,not mentioned,0,not mentioned,0,not mentioned,0,not mentioned,0,not mentioned,0,not mentioned,1,positive,0,not mentioned,0,not mentioned
2023-12-07T19:53:14.223Z,2023-12-07T19:53:14.223Z,approved,2024-11-28,5 Stars,Worth every dime.,5 Stars: Worth every dime.,5,1.0,0,0,False,Verve Chair,,//www.branchfurniture.com/products/verve-chair,https://cdn.shopify.com/s/files/1/0124/5662/4187/products/coralherocopy_x280.jpg?v=1652368917,,,,,0,not mentioned,0,not mentioned,0,not mentioned,0,not mentioned,0,not mentioned,1,positive,0,not mentioned,0,not mentioned,0,not mentioned,0,not mentioned,0,not mentioned,0,not mentioned,0,not mentioned,0,not mentioned,0,not mentioned,0,not mentioned,0,not mentioned,0,not mentioned,0,not mentioned,0,not mentioned
2023-12-07T19:51:26.090Z,2023-12-07T19:51:26.090Z,approved,2024-11-28,5 Stars,"Very comfy, looks great!","5 Stars: Very comfy, looks great!",5,1.0,0,0,False,Verve Chair,,//www.branchfurniture.com/products/verve-chair,https://cdn.shopify.com/s/files/1/0124/5662/4187/products/coralherocopy_x280.jpg?v=1652368917,,,,,0,not mentioned,0,not mentioned,0,not mentioned,0,not mentioned,0,not mentioned,1,positive,0,not mentioned,0,not mentioned,0,not mentioned,0,not mentioned,0,not mentioned,0,not mentioned,1,positive,1,positive,0,not mentioned,0,not mentioned,0,not mentioned,1,positive,0,not mentioned,0,not mentioned
2023-12-07T19:51:26.000Z,2023-12-07T19:51:26.000Z,approved,2024-11-28,5 Stars,"Very comfy, looks great!","5 Stars: Very comfy, looks great!",5,1.0,0,0,False,Verve Chair,Mist / Standard,//www.branchfurniture.com/products/verve-chair,https://cdn.shopify.com/s/files/1/0124/5662/4187/files/20220513_VerveChair_FrontPersp_Mist_x280.jpg?v=1695306444,39633980325923,,,,0,not mentioned,0,not mentioned,0,not mentioned,0,not mentioned,0,not mentioned,1,positive,0,not mentioned,0,not mentioned,0,not mentioned,0,not mentioned,0,not mentioned,0,not mentioned,1,positive,1,positive,0,not mentioned,0,not mentioned,0,not mentioned,1,positive,0,not mentioned,0,not mentioned
2023-12-07T19:43:27.697Z,2023-12-07T19:43:27.697Z,approved,2024-11-28,5 Stars,"Love it! It’s comfortable, functional, and super easy to assemble.","5 Stars: Love it! It’s comfortable, functional, and super easy to assemble.",5,1.0,0,0,False,Verve Chair,,//www.branchfurniture.com/products/verve-chair,https://cdn.shopify.com/s/files/1/0124/5662/4187/products/coralherocopy_x280.jpg?v=1652368917,,,,,0,not mentioned,0,not mentioned,0,not mentioned,0,not mentioned,0,not mentioned,0,not mentioned,0,not mentioned,0,not mentioned,0,not mentioned,1,positive,0,not mentioned,0,not mentioned,0,not mentioned,1,positive,0,not mentioned,0,not mentioned,0,not mentioned,0,not mentioned,0,not mentioned,0,not mentioned
2023-12-07T19:41:04.857Z,2023-12-07T19:41:04.857Z,approved,2024-11-28,5 Stars,Love the color. Hefty and well constructed. Very comfortable and adjustable.,5 Stars: Love the color. Hefty and well constructed. Very comfortable and adjustable.,5,1.0,0,0,False,Verve Chair,,//www.branchfurniture.com/products/verve-chair,https://cdn.shopify.com/s/files/1/0124/5662/4187/products/coralherocopy_x280.jpg?v=1652368917,,,,,0,not mentioned,1,positive,0,not mentioned,0,not mentioned,0,not mentioned,1,positive,0,not mentioned,0,not mentioned,0,not mentioned,0,not mentioned,0,not mentioned,0,not mentioned,1,positive,1,positive,0,not mentioned,0,not mentioned,0,not mentioned,1,positive,0,not mentioned,0,not mentioned
2023-12-07T19:38:31.237Z,2023-12-07T19:38:31.237Z,approved,2024-11-28,5 Stars,The best office chair I have ever sat on!,5 Stars: The best office chair I have ever sat on!,5,1.0,0,0,False,Verve Chair,,//www.branchfurniture.com/products/verve-chair,https://cdn.shopify.com/s/files/1/0124/5662/4187/products/coralherocopy_x280.jpg?v=1652368917,,,,,0,not mentioned,0,not mentioned,0,not mentioned,0,not mentioned,0,not mentioned,0,not mentioned,1,positive,0,not mentioned,0,not mentioned,0,not mentioned,0,not mentioned,0,not mentioned,0,not mentioned,0,not mentioned,0,not mentioned,0,not mentioned,0,not mentioned,0,not mentioned,0,not mentioned,0,not mentioned
2023-12-07T19:37:18.810Z,2023-12-07T19:37:18.810Z,approved,2024-11-28,5 Stars,"I'm 43 years old and have sat in many chairs throughout my 20+ years in the workforce. None of them compare to this chair. Now that I work from home, it's imperative that I have something that I enjoy sitting in. This chair is comfortable, stylish, flexible, and easy to put together. It feels sturdy and glides across my floor with ease. The price is worth every cent and I would easily buy it again if needed. I will recommend this to anyone looking for a gorgeous and comfortable fixture in their home.","5 Stars: I'm 43 years old and have sat in many chairs throughout my 20+ years in the workforce. None of them compare to this chair. Now that I work from home, it's imperative that I have something that I enjoy sitting in. This chair is comfortable, stylish, flexible, and easy to put together. It feels sturdy and glides across my floor with ease. The price is worth every cent and I would easily buy it again if needed. I will recommend this to anyone looking for a gorgeous and comfortable fixture in their home.",5,1.0,0,0,False,Verve Chair,,//www.branchfurniture.com/products/verve-chair,https://cdn.shopify.com/s/files/1/0124/5662/4187/products/coralherocopy_x280.jpg?v=1652368917,,,,,1,positive,1,positive,0,not mentioned,1,positive,0,not mentioned,1,positive,1,positive,0,not mentioned,0,not mentioned,1,positive,0,not mentioned,1,positive,1,positive,1,positive,0,not mentioned,0,not mentioned,0,not mentioned,1,positive,0,not mentioned,1,positive
2023-12-07T19:34:26.537Z,2023-12-07T19:34:26.537Z,approved,2024-11-28,5 Stars,Comfortable to sit on all day!,5 Stars: Comfortable to sit on all day!,5,1.0,0,0,False,Verve Chair,,//www.branchfurniture.com/products/verve-chair,https://cdn.shopify.com/s/files/1/0124/5662/4187/products/coralherocopy_x280.jpg?v=1652368917,,,,,0,not mentioned,0,not mentioned,0,not mentioned,0,not mentioned,0,not mentioned,0,not mentioned,0,not mentioned,0,not mentioned,0,not mentioned,0,not mentioned,0,not mentioned,0,not mentioned,0,not mentioned,1,positive,0,not mentioned,0,not mentioned,0,not mentioned,0,not mentioned,0,not mentioned,0,not mentioned
2023-12-07T19:33:26.700Z,2023-12-07T19:33:26.700Z,approved,2024-11-28,5 Stars,Very comfortable and looks great in my office!,5 Stars: Very comfortable and looks great in my office!,5,1.0,0,0,False,Verve Chair,,//www.branchfurniture.com/products/verve-chair,https://cdn.shopify.com/s/files/1/0124/5662/4187/products/coralherocopy_x280.jpg?v=1652368917,,,,,0,not mentioned,0,not mentioned,0,not mentioned,0,not mentioned,0,not mentioned,1,positive,1,positive,0,not mentioned,0,not mentioned,0,not mentioned,0,not mentioned,0,not mentioned,0,not mentioned,1,positive,0,not mentioned,0,not mentioned,0,not mentioned,1,positive,0,not mentioned,0,not mentioned
2023-12-03T19:57:26.700Z,2023-12-03T19:57:26.700Z,approved,2024-11-28,5 Stars,"Perfect for our modern office. Very comfortable, especially with the lumbar support.","5 Stars: Perfect for our modern office. Very comfortable, especially with the lumbar support.",5,1.0,0,0,False,Verve Chair,,//www.branchfurniture.com/products/verve-chair,https://cdn.shopify.com/s/files/1/0124/5662/4187/products/coralherocopy_x280.jpg?v=1652368917,,,,,0,not mentioned,0,not mentioned,0,not mentioned,0,not mentioned,0,not mentioned,0,not mentioned,0,not mentioned,0,not mentioned,0,not mentioned,0,not mentioned,0,not mentioned,1,positive,1,positive,1,positive,0,not mentioned,0,not mentioned,0,not mentioned,1,positive,0,not mentioned,0,not mentioned
2023-12-03T19:57:26.000Z,2023-12-03T19:57:26.000Z,approved,2024-11-28,5 Stars,"Perfect for our modern office. Very comfortable, especially with the lumbar support.","5 Stars: Perfect for our modern office. Very comfortable, especially with the lumbar support.",5,1.0,0,0,False,Verve Chair,Mist / Standard,//www.branchfurniture.com/products/verve-chair,https://cdn.shopify.com/s/files/1/0124/5662/4187/files/20220513_VerveChair_FrontPersp_Mist_x280.jpg?v=1695306444,39633980325923,,,,0,not mentioned,0,not mentioned,0,not mentioned,1,positive,0,not mentioned,0,not mentioned,0,not mentioned,0,not mentioned,0,not mentioned,0,not mentioned,0,not mentioned,1,positive,0,not mentioned,1,positive,0,not mentioned,0,not mentioned,0,not mentioned,1,positive,0,not mentioned,0,not mentioned
2023-12-02T17:01:40.607Z,2023-12-02T17:01:40.607Z,approved,2024-11-28,"Wonderful, ergonomic, high-quality, beautifully designed chair!","First, regarding the size of this chair: this is a standard size office chair which should fit most people in a fairly wide middle range of the height and weight curve. I am a 6'0"", 175-pounds male and this chair fits me perfectly, with plenty of room left and additional height adjustment available, so it's hard for me to understand reviews complaining about the small size. This chair was designed so thoughtfully and economically that all unnecessary bulk was eliminated, contributing to it's very elegant and esthetically pleasing appearance. The quality of the materials is top-notch, warm and pleasant to the touch. The seat is soft and yet firm enough to keep me from sinking to the bottom of the seat frame like I did in every other office chair I tried. Like the rest of this chair, the ergonomics were designed thoughtfully to fit most people's needs, without pilling on unnecessary adjustments. The back support on this chair is the most comfortable and effective I've experienced. Overall, this is the best office chair of the many, many... many I have tried and a tremendous value. I do, however, understand that chairs are kind of like clothes and shoes where one size does not fit all, but I sure am glad this one was a fit for me. PS: I even liked the arm rests system! Very elegant and functional.","Wonderful, ergonomic, high-quality, beautifully designed chair!: First, regarding the size of this chair: this is a standard size office chair which should fit most people in a fairly wide middle range of the height and weight curve. I am a 6'0"", 175-pounds male and this chair fits me perfectly, with plenty of room left and additional height adjustment available, so it's hard for me to understand reviews complaining about the small size. This chair was designed so thoughtfully and economically that all unnecessary bulk was eliminated, contributing to it's very elegant and esthetically pleasing appearance. The quality of the materials is top-notch, warm and pleasant to the touch. The seat is soft and yet firm enough to keep me from sinking to the bottom of the seat frame like I did in every other office chair I tried. Like the rest of this chair, the ergonomics were designed thoughtfully to fit most people's needs, without pilling on unnecessary adjustments. The back support on this chair is the most comfortable and effective I've experienced. Overall, this is the best office chair of the many, many... many I have tried and a tremendous value. I do, however, understand that chairs are kind of like clothes and shoes where one size does not fit all, but I sure am glad this one was a fit for me. PS: I even liked the arm rests system! Very elegant and functional.",5,1.0,0,0,False,Verve Chair,,//www.branchfurniture.com/products/verve-chair,https://cdn.shopify.com/s/files/1/0124/5662/4187/products/coralherocopy_x280.jpg?v=1652368917,,,,,1,positive,1,positive,1,positive,1,positive,1,positive,1,positive,1,positive,0,not mentioned,0,not mentioned,0,not mentioned,0,not mentioned,1,positive,1,positive,1,positive,0,not mentioned,1,positive,1,positive,1,positive,0,not mentioned,0,not mentioned
