411,078f1c8e-ef51-4102-81e5-49708f3c4a8e,2023-02-23T18:42:43.517Z,2023-02-23T18:42:43.517Z,approved,2024-11-28,Enjoying my chair,"It took a few tweaks to get it perfect, but I think I am there! Everyone loves the Coral color especially since it matches my Mac desk top computer. And I found some flower pots that also match. I can work longer in comfort. Thank you.","Enjoying my chair: It took a few tweaks to get it perfect, but I think I am there! Everyone loves the Coral color especially since it matches my Mac desk top computer. And I found some flower pots that also match. I can work longer in comfort. Thank you.",5,1.0,0,0,False,Verve Chair,,//www.branchfurniture.com/products/verve-chair,https://cdn.shopify.com/s/files/1/0124/5662/4187/products/coralherocopy_x280.jpg?v=1652368917,,,,,,1,positive,1,positive,0,not mentioned,0,not mentioned,0,not mentioned,1,positive,1,positive,0,not mentioned,0,not mentioned,0,not mentioned,0,not mentioned,0,not mentioned,0,not mentioned,1,positive,0,not mentioned,0,not mentioned,0,not mentioned,1,positive,0,not mentioned,0,not mentioned
412,5bb18e1b-bbfe-4336-8ebd-77cfb52b0cbc,2023-02-22T20:14:04.650Z,2023-02-22T20:14:04.650Z,approved,2024-11-28,Great chair for looks + comfort,"Experience so far is great, a few weeks in. My only wish is that the arm rests went up higher, but it's a minor thing.","Great chair for looks + comfort: Experience so far is great, a few weeks in. My only wish is that the arm rests went up higher, but it's a minor thing.",5,1.0,0,0,False,Verve Chair,,//www.branchfurniture.com/products/verve-chair,https://cdn.shopify.com/s/files/1/0124/5662/4187/products/coralherocopy_x280.jpg?v=1652368917,,,,,,0,not mentioned,1,neutral,1,negative,1,positive,0,not mentioned,1,positive,1,positive,0,not mentioned,0,not mentioned,0,not mentioned,0,not mentioned,1,positive,1,positive,1,positive,0,not mentioned,0,not mentioned,0,not mentioned,1,positive,0,not mentioned,0,not mentioned
413,c5824cd1-fc8a-4183-95eb-d057edb8a9ed,2023-02-22T19:32:08.970Z,2023-02-22T19:32:08.970Z,approved,2024-11-28,Fantastic upgrade,"This is my first premium office chair. I have definitely been the $150 variety up until now. I wasn't really sure what I was missing. But I think I know now. I'm really impressed with the build quality. Smooth, heavy and solid. The seat is really nice compared to my previous chair that was what I immediately noticed. 

I think this is the sweet spot for me in terms of getting a high quality chair with a good amount of customizations.","Fantastic upgrade: This is my first premium office chair. I have definitely been the $150 variety up until now. I wasn't really sure what I was missing. But I think I know now. I'm really impressed with the build quality. Smooth, heavy and solid. The seat is really nice compared to my previous chair that was what I immediately noticed. 

I think this is the sweet spot for me in terms of getting a high quality chair with a good amount of customizations.",5,1.0,0,0,False,Verve Chair,,//www.branchfurniture.com/products/verve-chair,https://cdn.shopify.com/s/files/1/0124/5662/4187/products/coralherocopy_x280.jpg?v=1652368917,,,,,,0,not mentioned,1,positive,0,not mentioned,0,not mentioned,0,not mentioned,1,positive,0,not mentioned,0,not mentioned,0,not mentioned,0,not mentioned,0,not mentioned,0,not mentioned,1,positive,0,not mentioned,0,not mentioned,0,not mentioned,0,not mentioned,0,not mentioned,0,not mentioned,0,not mentioned
414,5dc8bc02-6dcc-4127-8abd-77e786ff2c06,2023-02-19T19:24:43.463Z,2023-02-19T19:24:43.463Z,approved,2024-11-28,Awesome Comfortable Office/Gaming Chair,"Great shipping EASY ASSEMBLE! Very well put together. 
I love it l! long Hours sitting don’t bother me! Very Sturdy","Awesome Comfortable Office/Gaming Chair: Great shipping EASY ASSEMBLE! Very well put together. 
I love it l! long Hours sitting don’t bother me! Very Sturdy",5,1.0,0,0,False,Verve Chair,,//www.branchfurniture.com/products/verve-chair,https://cdn.shopify.com/s/files/1/0124/5662/4187/products/coralherocopy_x280.jpg?v=1652368917,,,,,,0,not mentioned,0,not mentioned,0,not mentioned,0,not mentioned,0,not mentioned,1,positive,0,not mentioned,1,positive,1,positive,1,positive,0,not mentioned,0,not mentioned,1,positive,1,positive,0,not mentioned,0,not mentioned,0,not mentioned,0,not mentioned,0,not mentioned,0,not mentioned
415,44881dfe-bb67-446a-994b-991c08c4b86d,2023-02-17T18:25:30.427Z,2023-02-17T18:25:30.427Z,approved,2024-11-28,Very comfortable,I work from home and needed a new chair. I researched this for months and finally decided on Branch after reading all the positive reviews and I liked the looks of the chair. I decided on the Verve chair. The mesh back is ver comfortable and hugs your back. It also helps you sit more up right without being to much. The seat is soft yet firm. It feels like it will hold up well over time. I can honestly say it is comfortable to sit in for 8-10 hours a day. My one small complaint would be the lack of padding on the arm rests. While there is some padding there it could be a little more or a little softer. With that said I would still highly recommend this chair.,Very comfortable: I work from home and needed a new chair. I researched this for months and finally decided on Branch after reading all the positive reviews and I liked the looks of the chair. I decided on the Verve chair. The mesh back is ver comfortable and hugs your back. It also helps you sit more up right without being to much. The seat is soft yet firm. It feels like it will hold up well over time. I can honestly say it is comfortable to sit in for 8-10 hours a day. My one small complaint would be the lack of padding on the arm rests. While there is some padding there it could be a little more or a little softer. With that said I would still highly recommend this chair.,5,1.0,0,0,False,Verve Chair,,//www.branchfurniture.com/products/verve-chair,https://cdn.shopify.com/s/files/1/0124/5662/4187/products/coralherocopy_x280.jpg?v=1652368917,,,,,"[{'largePortraitThumbnailUrl': '//d4yxl4pe8dqlj.cloudfront.net/images/49d51961-337e-46f0-96d6-e89d05286d60/9948ee71-b949-41e9-90c5-2fa57ccad615_thumbnail_portrait_large.jpg', 'streamId': '9948ee71-b949-41e9-90c5-2fa57ccad615', 'fullSizeUrl': '//d4yxl4pe8dqlj.cloudfront.net/images/49d51961-337e-46f0-96d6-e89d05286d60/9948ee71-b949-41e9-90c5-2fa57ccad615_full_size.jpg', 'largeUrl': '//d4yxl4pe8dqlj.cloudfront.net/images/49d51961-337e-46f0-96d6-e89d05286d60/9948ee71-b949-41e9-90c5-2fa57ccad615_large.jpg', 'type': 'image', 'dynamicKey': '49d51961-337e-46f0-96d6-e89d05286d60/9948ee71-b949-41e9-90c5-2fa57ccad615', 'thumbnailUrl': '//d4yxl4pe8dqlj.cloudfront.net/images/49d51961-337e-46f0-96d6-e89d05286d60/9948ee71-b949-41e9-90c5-2fa57ccad615_thumbnail_120_120.jpg'}, {'largePortraitThumbnailUrl': '//d4yxl4pe8dqlj.cloudfront.net/images/49d51961-337e-46f0-96d6-e89d05286d60/ece4fc17-1a96-4573-ba23-33fac7473528_thumbnail_portrait_large.jpg', 'streamId': 'ece4fc17-1a96-4573-ba23-33fac7473528', 'fullSizeUrl': '//d4yxl4pe8dqlj.cloudfront.net/images/49d51961-337e-46f0-96d6-e89d05286d60/ece4fc17-1a96-4573-ba23-33fac7473528_full_size.jpg', 'largeUrl': '//d4yxl4pe8dqlj.cloudfront.net/images/49d51961-337e-46f0-96d6-e89d05286d60/ece4fc17-1a96-4573-ba23-33fac7473528_large.jpg', 'type': 'image', 'dynamicKey': '49d51961-337e-46f0-96d6-e89d05286d60/ece4fc17-1a96-4573-ba23-33fac7473528', 'thumbnailUrl': '//d4yxl4pe8dqlj.cloudfront.net/images/49d51961-337e-46f0-96d6-e89d05286d60/ece4fc17-1a96-4573-ba23-33fac7473528_thumbnail_120_120.jpg'}]",0,not mentioned,0,not mentioned,1,negative,1,positive,0,not mentioned,1,positive,1,positive,0,not mentioned,0,not mentioned,0,not mentioned,1,positive,1,positive,1,positive,1,positive,0,not mentioned,1,positive,0,not mentioned,1,positive,0,not mentioned,0,not mentioned
416,5f6334d3-be16-4f83-826d-0f9e7dc6ff9f,2023-02-15T01:43:15.250Z,2023-02-15T01:43:15.250Z,approved,2024-11-28,Love my chair!,"Its like night and day from what I had before. This is so comfortable and supportive my posture -- that I dont realize Im sitting in a chair. Its just comfort, and support. What more does one need in a chair, really?","Love my chair!: Its like night and day from what I had before. This is so comfortable and supportive my posture -- that I dont realize Im sitting in a chair. Its just comfort, and support. What more does one need in a chair, really?",5,1.0,0,0,False,Verve Chair,,//www.branchfurniture.com/products/verve-chair,https://cdn.shopify.com/s/files/1/0124/5662/4187/products/coralherocopy_x280.jpg?v=1652368917,,,,,,0,not mentioned,0,not mentioned,0,not mentioned,0,not mentioned,0,not mentioned,1,positive,1,positive,0,not mentioned,0,not mentioned,0,not mentioned,0,not mentioned,1,positive,1,positive,1,positive,0,not mentioned,0,not mentioned,0,not mentioned,0,not mentioned,0,not mentioned,0,not mentioned
417,b2c045e7-2fb5-4277-aa69-834358f0abfd,2023-02-14T23:15:09.877Z,2023-02-14T23:15:09.877Z,approved,2024-11-28,Verve Chair,"Great chair, wish I had it years ago!","Verve Chair: Great chair, wish I had it years ago!",5,1.0,0,0,False,Verve Chair,,//www.branchfurniture.com/products/verve-chair,https://cdn.shopify.com/s/files/1/0124/5662/4187/products/coralherocopy_x280.jpg?v=1652368917,,,,,,0,not mentioned,0,not mentioned,0,not mentioned,0,not mentioned,0,not mentioned,0,not mentioned,0,not mentioned,0,not mentioned,0,not mentioned,0,not mentioned,0,not mentioned,0,not mentioned,0,not mentioned,0,not mentioned,0,not mentioned,0,not mentioned,0,not mentioned,1,positive,0,not mentioned,0,not mentioned
418,2c85331d-f69b-4c19-a052-33b1b68a4cf2,2023-02-13T21:06:56.543Z,2023-02-13T21:06:56.543Z,approved,2024-11-28,Chair,The chair is comfortable and adjustments are great,Chair: The chair is comfortable and adjustments are great,5,1.0,0,0,False,Verve Chair,,//www.branchfurniture.com/products/verve-chair,https://cdn.shopify.com/s/files/1/0124/5662/4187/products/coralherocopy_x280.jpg?v=1652368917,,,,,,0,not mentioned,1,positive,0,not mentioned,0,not mentioned,0,not mentioned,0,not mentioned,0,not mentioned,0,not mentioned,0,not mentioned,0,not mentioned,0,not mentioned,0,not mentioned,0,not mentioned,1,positive,0,not mentioned,0,not mentioned,0,not mentioned,0,not mentioned,0,not mentioned,0,not mentioned
419,40cc6c45-1c81-445c-a995-80498c77accf,2023-02-11T18:43:00.127Z,2023-02-11T18:43:00.127Z,approved,2024-11-28,Super comfy and pretty,Love the chair. The fabric snags a little easily whenever my jewelry moves against it. But worth it for the comfort factor,Super comfy and pretty: Love the chair. The fabric snags a little easily whenever my jewelry moves against it. But worth it for the comfort factor,5,1.0,0,0,False,Verve Chair,,//www.branchfurniture.com/products/verve-chair,https://cdn.shopify.com/s/files/1/0124/5662/4187/products/coralherocopy_x280.jpg?v=1652368917,,,,,,0,not mentioned,0,not mentioned,0,not mentioned,0,not mentioned,0,not mentioned,1,positive,1,positive,0,not mentioned,0,not mentioned,0,not mentioned,0,not mentioned,0,not mentioned,1,positive,1,positive,0,not mentioned,0,not mentioned,0,not mentioned,1,positive,0,not mentioned,0,not mentioned
420,392d2e44-9e4a-4f04-8f4e-26398c0eaa7d,2023-02-07T13:02:51.330Z,2023-02-07T13:02:51.330Z,approved,2024-11-28,An excellent chair - and great value,"This chair is an excellent value - as sturdy and polished as any office chair I’ve used in the past 30 years - comfortable, clean design, and excellent back support. I especially love the way Branch has designed the adjustment features to help make the chair fit like a glove. Highly recommended!","An excellent chair - and great value: This chair is an excellent value - as sturdy and polished as any office chair I’ve used in the past 30 years - comfortable, clean design, and excellent back support. I especially love the way Branch has designed the adjustment features to help make the chair fit like a glove. Highly recommended!",5,1.0,0,0,False,Verve Chair,,//www.branchfurniture.com/products/verve-chair,https://cdn.shopify.com/s/files/1/0124/5662/4187/products/coralherocopy_x280.jpg?v=1652368917,,,,,,1,positive,1,positive,0,not mentioned,1,positive,0,not mentioned,1,positive,1,positive,0,not mentioned,0,not mentioned,0,not mentioned,0,not mentioned,1,positive,1,positive,1,positive,0,not mentioned,0,not mentioned,0,not mentioned,1,positive,0,not mentioned,0,not mentioned
421,79ca83ea-176a-40b7-85d8-82601f2dc417,2023-02-02T18:21:38.387Z,2023-02-02T18:21:38.387Z,approved,2024-11-28,Great chair,"Fantastic chair! It's sleek, stylish and so comfy. I love that the seat depth adjusts and the back comfort can be changed quickly. Putting it together was a breeze!","Great chair: Fantastic chair! It's sleek, stylish and so comfy. I love that the seat depth adjusts and the back comfort can be changed quickly. Putting it together was a breeze!",5,1.0,0,0,False,Verve Chair,,//www.branchfurniture.com/products/verve-chair,https://cdn.shopify.com/s/files/1/0124/5662/4187/products/coralherocopy_x280.jpg?v=1652368917,,,,,,0,not mentioned,1,positive,0,not mentioned,1,positive,0,not mentioned,0,not mentioned,0,not mentioned,0,not mentioned,0,not mentioned,1,positive,0,not mentioned,0,not mentioned,1,positive,1,positive,0,not mentioned,0,not mentioned,0,not mentioned,1,positive,0,not mentioned,0,not mentioned
422,58caeaeb-d77b-4bf6-9a24-f1b9b3bff2d7,2023-02-02T16:51:18.177Z,2023-02-02T16:51:18.177Z,approved,2024-11-28,So close but a few design flaws,It is beautiful which is important to me. However I expected the lumbar support to be adjustable all the way up the back. It has a very limited range. Also the back only reclines and locks BUT you can not adjust it to be fully upright for true active sitting. Therefor the lumbar support is useless because I would have to lean back on it. Leaning back at all kills my back. I have stuffed a dish towel in the lumbar support to have it reach my back (barely). Again because the back does not move upright I have had to make the seat very short (pushed back) to feel the lumbar support.,So close but a few design flaws: It is beautiful which is important to me. However I expected the lumbar support to be adjustable all the way up the back. It has a very limited range. Also the back only reclines and locks BUT you can not adjust it to be fully upright for true active sitting. Therefor the lumbar support is useless because I would have to lean back on it. Leaning back at all kills my back. I have stuffed a dish towel in the lumbar support to have it reach my back (barely). Again because the back does not move upright I have had to make the seat very short (pushed back) to feel the lumbar support.,5,1.0,0,0,False,Verve Chair,,//www.branchfurniture.com/products/verve-chair,https://cdn.shopify.com/s/files/1/0124/5662/4187/products/coralherocopy_x280.jpg?v=1652368917,,,,,,0,not mentioned,1,negative,0,not mentioned,1,negative,0,not mentioned,0,not mentioned,0,not mentioned,0,not mentioned,0,not mentioned,0,not mentioned,0,not mentioned,1,negative,0,not mentioned,1,negative,0,not mentioned,0,not mentioned,0,not mentioned,1,positive,0,not mentioned,0,not mentioned
423,fe69a4b0-3d2f-48cc-99d3-435a46cef410,2023-02-02T14:04:46.290Z,2023-02-02T14:04:46.290Z,approved,2024-11-28,Very comfortable and adjustable,"I'm 6'1 and I'm using the max settings of the chair, which are fine for me. I wouldn't recommend to anyone taller than me. Otherwise, for people 6'1 and less, great chair for a reasonable price","Very comfortable and adjustable: I'm 6'1 and I'm using the max settings of the chair, which are fine for me. I wouldn't recommend to anyone taller than me. Otherwise, for people 6'1 and less, great chair for a reasonable price",5,1.0,0,0,False,Verve Chair,,//www.branchfurniture.com/products/verve-chair,https://cdn.shopify.com/s/files/1/0124/5662/4187/products/coralherocopy_x280.jpg?v=1652368917,,,,,,1,positive,1,positive,0,not mentioned,0,not mentioned,0,not mentioned,1,positive,0,not mentioned,0,not mentioned,0,not mentioned,0,not mentioned,0,not mentioned,0,not mentioned,0,not mentioned,1,positive,1,positive,0,not mentioned,1,negative,0,not mentioned,0,not mentioned,0,not mentioned
424,01fe7e4d-554b-4658-a89f-40884dab637b,2023-02-02T05:34:47.990Z,2023-02-02T05:34:47.990Z,approved,2024-11-28,Obsessed,I've been working from the floor at my coffee table for three years because I hadn't found a chair that suited me better. But this chair does! I haven't been on the floor since it arrived. It was SUPER simple to setup and is absolutely gorgeous.,Obsessed: I've been working from the floor at my coffee table for three years because I hadn't found a chair that suited me better. But this chair does! I haven't been on the floor since it arrived. It was SUPER simple to setup and is absolutely gorgeous.,5,1.0,0,0,False,Verve Chair,,//www.branchfurniture.com/products/verve-chair,https://cdn.shopify.com/s/files/1/0124/5662/4187/products/coralherocopy_x280.jpg?v=1652368917,,,,,,1,positive,1,positive,0,not mentioned,0,not mentioned,0,not mentioned,1,positive,1,positive,0,not mentioned,0,not mentioned,1,positive,0,not mentioned,0,not mentioned,1,positive,1,positive,0,not mentioned,0,not mentioned,0,not mentioned,1,positive,0,not mentioned,0,not mentioned
425,5cb2401d-c488-487b-8675-5e0d3127055e,2023-01-31T16:43:20.887Z,2023-01-31T16:43:20.887Z,approved,2024-11-28,The chair I was looking for,"I was looking for a new office chair to use for my home office space. I couldn't get anything too big, but I also wanted a chair that was big enough for me to criss-cross my legs. I really like how this is the right size for a lot of seated positions. The back is really comfortable. I really like how many points of adjustments there are on this chair as well. And I splurged on the pretty coral color which was worth it. 
And the assembly was really, really easy. Easier than some IKEA furniture :)","The chair I was looking for: I was looking for a new office chair to use for my home office space. I couldn't get anything too big, but I also wanted a chair that was big enough for me to criss-cross my legs. I really like how this is the right size for a lot of seated positions. The back is really comfortable. I really like how many points of adjustments there are on this chair as well. And I splurged on the pretty coral color which was worth it. 
And the assembly was really, really easy. Easier than some IKEA furniture :)",5,1.0,0,0,False,Verve Chair,,//www.branchfurniture.com/products/verve-chair,https://cdn.shopify.com/s/files/1/0124/5662/4187/products/coralherocopy_x280.jpg?v=1652368917,,,,,,1,positive,1,positive,0,not mentioned,1,positive,0,not mentioned,1,positive,0,not mentioned,0,not mentioned,0,not mentioned,1,positive,0,not mentioned,1,positive,1,positive,1,positive,0,not mentioned,0,not mentioned,0,not mentioned,1,positive,0,not mentioned,0,not mentioned
426,44de9a7e-89ae-4127-8050-f4c72704f08f,2023-01-25T18:56:00.580Z,2023-01-25T18:56:00.580Z,approved,2024-11-28,Less back pain - cute color,"Employer gave me money to buy a WFH chair; otherwise I'd never buy something this pricey. I have a tiny house and wanted something in a cute color since I can't tuck the chair out of the way. Also needed something that actually helps with the back pain I've accumulated from WFH life since COVID. I'm sort of shocked to report that my back hasn't hurt since I switched to this chair. I'm petite at 5'2"" and other than feeling a bit like I'm being ""pushed forward"" while sitting, it is supportive. Actually do recommend if you have the budget for it.","Less back pain - cute color: Employer gave me money to buy a WFH chair; otherwise I'd never buy something this pricey. I have a tiny house and wanted something in a cute color since I can't tuck the chair out of the way. Also needed something that actually helps with the back pain I've accumulated from WFH life since COVID. I'm sort of shocked to report that my back hasn't hurt since I switched to this chair. I'm petite at 5'2"" and other than feeling a bit like I'm being ""pushed forward"" while sitting, it is supportive. Actually do recommend if you have the budget for it.",5,1.0,0,0,False,Verve Chair,,//www.branchfurniture.com/products/verve-chair,https://cdn.shopify.com/s/files/1/0124/5662/4187/products/coralherocopy_x280.jpg?v=1652368917,,,,,"[{'largePortraitThumbnailUrl': '//d4yxl4pe8dqlj.cloudfront.net/images/49d51961-337e-46f0-96d6-e89d05286d60/55b84211-a391-486d-9e74-097bce2c8a86_thumbnail_portrait_large.jpg', 'streamId': '55b84211-a391-486d-9e74-097bce2c8a86', 'fullSizeUrl': '//d4yxl4pe8dqlj.cloudfront.net/images/49d51961-337e-46f0-96d6-e89d05286d60/55b84211-a391-486d-9e74-097bce2c8a86_full_size.jpg', 'largeUrl': '//d4yxl4pe8dqlj.cloudfront.net/images/49d51961-337e-46f0-96d6-e89d05286d60/55b84211-a391-486d-9e74-097bce2c8a86_large.jpg', 'type': 'image', 'dynamicKey': '49d51961-337e-46f0-96d6-e89d05286d60/55b84211-a391-486d-9e74-097bce2c8a86', 'thumbnailUrl': '//d4yxl4pe8dqlj.cloudfront.net/images/49d51961-337e-46f0-96d6-e89d05286d60/55b84211-a391-486d-9e74-097bce2c8a86_thumbnail_120_120.jpg'}]",1,positive,0,not mentioned,0,not mentioned,1,positive,0,not mentioned,1,positive,1,positive,0,not mentioned,0,not mentioned,0,not mentioned,0,not mentioned,1,positive,1,positive,1,positive,1,positive,0,not mentioned,0,not mentioned,1,positive,0,not mentioned,0,not mentioned
427,fc6fc0aa-1ae3-4339-b55f-c317bb04dd93,2023-01-25T18:51:20.343Z,2023-01-25T18:51:20.343Z,approved,2024-11-28,Less back pain - cute color,Employer gave me money to buy a WFH chair; otherwise I'd never buy something this pricey. I have a tiny house and wanted something in a cute color since I can't tuck the chair out of the way - as well as something that actually helps with the back pain I've accumulated from WFH life since COVID. I'm sort of shocked to report that my back hasn't hurt since I switched to this chair. Actually do recommend if you have the budget for it.,Less back pain - cute color: Employer gave me money to buy a WFH chair; otherwise I'd never buy something this pricey. I have a tiny house and wanted something in a cute color since I can't tuck the chair out of the way - as well as something that actually helps with the back pain I've accumulated from WFH life since COVID. I'm sort of shocked to report that my back hasn't hurt since I switched to this chair. Actually do recommend if you have the budget for it.,5,1.0,0,0,False,Verve Chair,,//www.branchfurniture.com/products/verve-chair,https://cdn.shopify.com/s/files/1/0124/5662/4187/products/coralherocopy_x280.jpg?v=1652368917,,,,,,0,not mentioned,0,not mentioned,0,not mentioned,1,positive,0,not mentioned,1,positive,1,positive,0,not mentioned,0,not mentioned,0,not mentioned,0,not mentioned,1,positive,0,not mentioned,1,positive,0,not mentioned,0,not mentioned,0,not mentioned,1,positive,0,not mentioned,0,not mentioned
