2023-08-14T19:09:11.760Z,2023-08-14T19:09:11.760Z,approved,2024-11-28,So far good,"Overall good.
Cons: 1. Product was not delivered to the door. 
 2. Handle is hard to hold on a fixed height
 3. Seat is a little tilted downwards","So far good: Overall good.
Cons: 1. Product was not delivered to the door. 
 2. Handle is hard to hold on a fixed height
 3. Seat is a little tilted downwards",4,1.0,0,0,False,Verve Chair,,//www.branchfurniture.com/products/verve-chair,https://cdn.shopify.com/s/files/1/0124/5662/4187/products/coralherocopy_x280.jpg?v=1652368917,,,,,0,not mentioned,0,not mentioned,0,not mentioned,0,not mentioned,0,not mentioned,0,not mentioned,0,not mentioned,0,not mentioned,1,negative,0,not mentioned,0,not mentioned,0,not mentioned,0,not mentioned,0,not mentioned,0,not mentioned,1,negative,0,not mentioned,0,not mentioned,0,not mentioned,0,not mentioned
2023-07-28T18:34:47.310Z,2023-07-28T18:34:47.310Z,approved,2024-11-28,Recommended,"I like it overall. It has nice features and the design looks great in my room. My only comment is the lowest height. As a 5’2”, it could go a bit lower than how it designed right now.","Recommended: I like it overall. It has nice features and the design looks great in my room. My only comment is the lowest height. As a 5’2”, it could go a bit lower than how it designed right now.",4,1.0,0,0,False,Verve Chair,,//www.branchfurniture.com/products/verve-chair,https://cdn.shopify.com/s/files/1/0124/5662/4187/products/coralherocopy_x280.jpg?v=1652368917,,,,,1,neutral,0,not mentioned,0,not mentioned,0,not mentioned,0,not mentioned,1,positive,1,positive,0,not mentioned,0,not mentioned,0,not mentioned,0,not mentioned,0,not mentioned,1,positive,0,not mentioned,1,negative,0,not mentioned,0,not mentioned,1,positive,0,not mentioned,0,not mentioned
2023-07-27T19:53:58.620Z,2023-07-27T19:53:58.620Z,approved,2024-11-28,Such an upgrade,I work from home and finally upgraded to a real desk chair. My body feels so much better at the end of the day. It was easy to assemble and feels like it will last a long time. Only complaint is the arms are a little wiggly.,Such an upgrade: I work from home and finally upgraded to a real desk chair. My body feels so much better at the end of the day. It was easy to assemble and feels like it will last a long time. Only complaint is the arms are a little wiggly.,4,1.0,0,0,False,Verve Chair,,//www.branchfurniture.com/products/verve-chair,https://cdn.shopify.com/s/files/1/0124/5662/4187/products/coralherocopy_x280.jpg?v=1652368917,,,,,1,positive,1,positive,1,negative,1,positive,0,not mentioned,1,positive,0,not mentioned,0,not mentioned,0,not mentioned,1,positive,1,positive,1,positive,1,positive,1,positive,0,not mentioned,0,not mentioned,0,not mentioned,0,not mentioned,0,not mentioned,0,not mentioned
2023-07-23T20:34:20.987Z,2023-07-23T20:34:20.987Z,approved,2024-11-28,Very Comfortable chair,"This is a very high-quality chair. The weight of it feels solid and it really supports me. I love all the adjustments - especially being able to change the seat depth. I did not attach the arms of this chair because it allows me to get closer to my desk (I have short arms). I would have loved the option to buy this chair without arms at a lower price (I've seen this with other manufacturers), but that's the only reason for I didn't give this a 5 star.","Very Comfortable chair: This is a very high-quality chair. The weight of it feels solid and it really supports me. I love all the adjustments - especially being able to change the seat depth. I did not attach the arms of this chair because it allows me to get closer to my desk (I have short arms). I would have loved the option to buy this chair without arms at a lower price (I've seen this with other manufacturers), but that's the only reason for I didn't give this a 5 star.",4,1.0,0,0,False,Verve Chair,,//www.branchfurniture.com/products/verve-chair,https://cdn.shopify.com/s/files/1/0124/5662/4187/products/coralherocopy_x280.jpg?v=1652368917,,,,,1,positive,1,positive,1,negative,1,neutral,0,not mentioned,1,positive,0,not mentioned,0,not mentioned,0,not mentioned,0,not mentioned,0,not mentioned,0,not mentioned,1,positive,1,positive,1,positive,0,not mentioned,0,not mentioned,0,not mentioned,0,not mentioned,0,not mentioned
2023-07-21T02:14:19.550Z,2023-07-21T02:14:19.550Z,approved,2024-11-28,great chair if you aren't tall,"if you're tall, the highest the lumbar support can adjust to still cannot go high enough to reach the small of my back, which is where it should rest. as a result, the lumbar support is essentially useless. otherwise satisifed","great chair if you aren't tall: if you're tall, the highest the lumbar support can adjust to still cannot go high enough to reach the small of my back, which is where it should rest. as a result, the lumbar support is essentially useless. otherwise satisifed",4,1.0,0,0,False,Verve Chair,,//www.branchfurniture.com/products/verve-chair,https://cdn.shopify.com/s/files/1/0124/5662/4187/products/coralherocopy_x280.jpg?v=1652368917,,,,,1,negative,1,negative,0,not mentioned,1,negative,0,not mentioned,1,neutral,1,neutral,0,not mentioned,0,not mentioned,0,not mentioned,0,not mentioned,1,negative,0,not mentioned,1,negative,1,negative,0,not mentioned,1,negative,0,not mentioned,0,not mentioned,0,not mentioned
2023-07-03T06:45:32.960Z,2023-07-03T06:45:32.960Z,approved,2024-11-28,4 Stars,"The chair is very comfortable, stylish, and the height is easily interchangeable between kids and myself. I do wish armrests were a little more substantial and they seem to fall down easily. Otherwise, we have been happy with the chair and feel it is durable.","4 Stars: The chair is very comfortable, stylish, and the height is easily interchangeable between kids and myself. I do wish armrests were a little more substantial and they seem to fall down easily. Otherwise, we have been happy with the chair and feel it is durable.",4,1.0,0,0,False,Verve Chair,,//www.branchfurniture.com/products/verve-chair,https://cdn.shopify.com/s/files/1/0124/5662/4187/products/coralherocopy_x280.jpg?v=1652368917,,,,,1,positive,1,positive,1,negative,1,neutral,0,not mentioned,1,positive,1,positive,0,not mentioned,0,not mentioned,0,not mentioned,1,positive,0,not mentioned,1,positive,1,positive,0,not mentioned,0,not mentioned,0,not mentioned,1,positive,0,not mentioned,0,not mentioned
2023-07-01T18:28:43.337Z,2023-07-01T18:28:43.337Z,approved,2024-11-28,Verve Chair,The back of the chair is too short. I also didn't realize that the chair was manufactured in China.,Verve Chair: The back of the chair is too short. I also didn't realize that the chair was manufactured in China.,4,1.0,0,0,False,Verve Chair,,//www.branchfurniture.com/products/verve-chair,https://cdn.shopify.com/s/files/1/0124/5662/4187/products/coralherocopy_x280.jpg?v=1652368917,,,,,0,not mentioned,0,not mentioned,0,not mentioned,1,negative,0,not mentioned,0,not mentioned,0,not mentioned,0,not mentioned,1,negative,0,not mentioned,0,not mentioned,0,not mentioned,0,not mentioned,0,not mentioned,0,not mentioned,0,not mentioned,0,not mentioned,0,not mentioned,0,not mentioned,0,not mentioned
2023-06-29T03:15:00.460Z,2023-06-29T03:15:00.460Z,approved,2024-11-28,Comfy!,"The color is beautiful and I’m happy I waited for the new mint color. I’m really happy with how adjustable the chair is. I think I’m a bit too tall, but it’s on me for not reading enough reviews.","Comfy!: The color is beautiful and I’m happy I waited for the new mint color. I’m really happy with how adjustable the chair is. I think I’m a bit too tall, but it’s on me for not reading enough reviews.",4,1.0,0,0,False,Verve Chair,,//www.branchfurniture.com/products/verve-chair,https://cdn.shopify.com/s/files/1/0124/5662/4187/products/coralherocopy_x280.jpg?v=1652368917,,,,,1,neutral,1,positive,0,not mentioned,0,not mentioned,0,not mentioned,0,not mentioned,0,not mentioned,0,not mentioned,0,not mentioned,0,not mentioned,0,not mentioned,0,not mentioned,0,not mentioned,0,not mentioned,1,negative,0,not mentioned,1,negative,1,positive,0,not mentioned,0,not mentioned
2023-06-22T18:33:16.150Z,2023-06-22T18:33:16.150Z,approved,2024-11-28,So far so good,"I like the chair so far. However, I think the chair seat material is a little rough/uncomfortable if you have on shorts or a short skirt/dress. Rubs on the legs.","So far so good: I like the chair so far. However, I think the chair seat material is a little rough/uncomfortable if you have on shorts or a short skirt/dress. Rubs on the legs.",4,1.0,0,0,False,Verve Chair,,//www.branchfurniture.com/products/verve-chair,https://cdn.shopify.com/s/files/1/0124/5662/4187/products/coralherocopy_x280.jpg?v=1652368917,,,,,0,not mentioned,0,not mentioned,0,not mentioned,0,not mentioned,0,not mentioned,0,not mentioned,0,not mentioned,0,not mentioned,0,not mentioned,0,not mentioned,0,not mentioned,0,not mentioned,1,negative,1,negative,0,not mentioned,1,negative,0,not mentioned,0,not mentioned,0,not mentioned,0,not mentioned
2023-06-02T17:47:00.797Z,2023-06-02T17:47:00.797Z,approved,2024-11-28,Good quality,"This chair is good if you are shorter, the adjustments are good as well. Wish the arm rest had a bit more cushion.","Good quality: This chair is good if you are shorter, the adjustments are good as well. Wish the arm rest had a bit more cushion.",4,1.0,0,0,False,Verve Chair,,//www.branchfurniture.com/products/verve-chair,https://cdn.shopify.com/s/files/1/0124/5662/4187/products/coralherocopy_x280.jpg?v=1652368917,,,,,1,positive,1,positive,1,negative,0,not mentioned,0,not mentioned,0,not mentioned,0,not mentioned,0,not mentioned,0,not mentioned,0,not mentioned,0,not mentioned,0,not mentioned,0,not mentioned,0,not mentioned,1,positive,0,not mentioned,0,not mentioned,0,not mentioned,0,not mentioned,0,not mentioned
2023-05-25T21:30:45.807Z,2023-05-25T21:30:45.807Z,approved,2024-11-28,"Mostly Great, Besides a Few Features","As a shorter guy (5' 7""), this chair looked like a good fit with all of the ergonomic features on top of a smaller footprint. As I'm getting into my late 30's, the gaming chair with zero support just wasn't cutting it anymore. The Verve overall looks great. The seat cushion is the perfect level of firmness, and the backrest has enough adjustment settings in terms of both tilt and pressure that I think most people can find a comfortable setting to use.

The couple of gripes I have are: 

1.) The armrests are pretty bad, as a lot of other reviews have indicated. They both feel and look flimsy, and are a pain to set to an optimal height. Can only move up and down, not forward/back or to the side to get them out of the way. There's no button, rather they are designed so that they fall all the way back down to their lowest position when you raise them past their highest adjustment point, which I feel is unintuitive and poorly thought out. The padding is also as thin as to be almost nonexistent; super firm and probably 1/16"" thick. I understand they fit the minimalist aesthetic, but for how high end the rest of the chair feels I think improvements can be made here.

2.) The lumbar support is way too aggressive depth-wise, and the adjustment options (especially for a chair that's almost $600) are lackluster. Fortunately I don't suffer from any back issues, so I tried using it for a couple days figuring I just needed to get used to it. Whenever I found a decent position, it would slide back down when I shifted around too much. I had to modify the seat depth and the firmness of the backrest just so that it wouldn't feel like it was digging into my spine, and after two days of this I grabbed one of my right angle low profile screwdrivers and just took it off. They really need a depth option on this thing as everyone is built differently.

Overall I'm happy with this chair after my ""DIY"" adjustments. Who knows, maybe I just have the straightest lumbar in the world but know that it can be removed with some finagling if you have the right tools.","Mostly Great, Besides a Few Features: As a shorter guy (5' 7""), this chair looked like a good fit with all of the ergonomic features on top of a smaller footprint. As I'm getting into my late 30's, the gaming chair with zero support just wasn't cutting it anymore. The Verve overall looks great. The seat cushion is the perfect level of firmness, and the backrest has enough adjustment settings in terms of both tilt and pressure that I think most people can find a comfortable setting to use.

The couple of gripes I have are: 

1.) The armrests are pretty bad, as a lot of other reviews have indicated. They both feel and look flimsy, and are a pain to set to an optimal height. Can only move up and down, not forward/back or to the side to get them out of the way. There's no button, rather they are designed so that they fall all the way back down to their lowest position when you raise them past their highest adjustment point, which I feel is unintuitive and poorly thought out. The padding is also as thin as to be almost nonexistent; super firm and probably 1/16"" thick. I understand they fit the minimalist aesthetic, but for how high end the rest of the chair feels I think improvements can be made here.

2.) The lumbar support is way too aggressive depth-wise, and the adjustment options (especially for a chair that's almost $600) are lackluster. Fortunately I don't suffer from any back issues, so I tried using it for a couple days figuring I just needed to get used to it. Whenever I found a decent position, it would slide back down when I shifted around too much. I had to modify the seat depth and the firmness of the backrest just so that it wouldn't feel like it was digging into my spine, and after two days of this I grabbed one of my right angle low profile screwdrivers and just took it off. They really need a depth option on this thing as everyone is built differently.

Overall I'm happy with this chair after my ""DIY"" adjustments. Who knows, maybe I just have the straightest lumbar in the world but know that it can be removed with some finagling if you have the right tools.",4,1.0,0,0,False,Verve Chair,,//www.branchfurniture.com/products/verve-chair,https://cdn.shopify.com/s/files/1/0124/5662/4187/products/coralherocopy_x280.jpg?v=1652368917,,,,,1,positive,1,positive,1,negative,1,negative,0,not mentioned,1,positive,1,positive,0,not mentioned,0,not mentioned,1,positive,0,not mentioned,1,negative,1,positive,1,neutral,1,positive,1,positive,0,not mentioned,1,positive,0,not mentioned,0,not mentioned
2023-05-16T20:09:48.217Z,2023-05-16T20:09:48.217Z,approved,2024-11-28,"Stellar chair overall, armrest construction- whoops","The chair is very comfortable, and the color and fabric is very attractive- a much better fit for our home than the Herman Miller options, which were nearly twice the price. Most adjustments feel just right. However, the armrests do not stay in position as advertised, and it would be quite nice to be able to tilt the seat up a bit.","Stellar chair overall, armrest construction- whoops: The chair is very comfortable, and the color and fabric is very attractive- a much better fit for our home than the Herman Miller options, which were nearly twice the price. Most adjustments feel just right. However, the armrests do not stay in position as advertised, and it would be quite nice to be able to tilt the seat up a bit.",4,1.0,0,0,False,Verve Chair,,//www.branchfurniture.com/products/verve-chair,https://cdn.shopify.com/s/files/1/0124/5662/4187/products/coralherocopy_x280.jpg?v=1652368917,,,,,1,positive,1,positive,1,negative,0,not mentioned,1,positive,1,positive,0,not mentioned,0,not mentioned,0,not mentioned,0,not mentioned,0,not mentioned,0,not mentioned,1,positive,1,positive,0,not mentioned,0,not mentioned,0,not mentioned,1,positive,0,not mentioned,0,not mentioned
2023-05-03T00:06:39.877Z,2023-05-03T00:06:39.877Z,approved,2024-11-28,Great chair but lumbar support could be better,"It very comfortable for an 8 hour day. However, the lumbar support does not stay in place for me & I am constantly adjusting it. Other than that, it's a great chair and I love the color. I got coral and it goes great with my decor.","Great chair but lumbar support could be better: It very comfortable for an 8 hour day. However, the lumbar support does not stay in place for me & I am constantly adjusting it. Other than that, it's a great chair and I love the color. I got coral and it goes great with my decor.",4,1.0,0,0,False,Verve Chair,,//www.branchfurniture.com/products/verve-chair,https://cdn.shopify.com/s/files/1/0124/5662/4187/products/coralherocopy_x280.jpg?v=1652368917,,,,,0,not mentioned,1,neutral,0,not mentioned,1,negative,0,not mentioned,1,positive,1,positive,0,not mentioned,0,not mentioned,0,not mentioned,0,not mentioned,1,negative,1,positive,1,positive,0,not mentioned,0,not mentioned,0,not mentioned,1,positive,0,not mentioned,0,not mentioned
2023-04-27T18:28:00.713Z,2023-04-27T18:28:00.713Z,approved,2024-11-28,4 Stars,Chair's great but too short for me so I haven't gotten to use it much yet. I'm wondering if I can find a compatible replacement cylinder that would be able to make it just a bit taller. Recommendations welcome :),4 Stars: Chair's great but too short for me so I haven't gotten to use it much yet. I'm wondering if I can find a compatible replacement cylinder that would be able to make it just a bit taller. Recommendations welcome :),4,1.0,0,0,False,Verve Chair,,//www.branchfurniture.com/products/verve-chair,https://cdn.shopify.com/s/files/1/0124/5662/4187/products/coralherocopy_x280.jpg?v=1652368917,,,,,1,negative,1,neutral,0,not mentioned,0,not mentioned,0,not mentioned,0,not mentioned,0,not mentioned,0,not mentioned,0,not mentioned,0,not mentioned,0,not mentioned,0,not mentioned,0,not mentioned,0,not mentioned,1,neutral,0,not mentioned,1,negative,0,not mentioned,0,not mentioned,0,not mentioned
2023-04-18T22:27:35.853Z,2023-04-18T22:27:35.853Z,approved,2024-11-28,Solid chair with a couple kinks,"It's comfortable and adjustable. Assembly was quick and simple too. As has been mentioned in other reviews, the arm rests can be a bit finicky at times, but largely they do their job without issue. A problem that I personally ran into (and which I'm unsure whether it's a defect of the particular chair I got or a larger issue with the entire line) is that the adjustable lumbar won't stay in place, as it tends to slide down when put into higher positions. overall, I'm happy with it","Solid chair with a couple kinks: It's comfortable and adjustable. Assembly was quick and simple too. As has been mentioned in other reviews, the arm rests can be a bit finicky at times, but largely they do their job without issue. A problem that I personally ran into (and which I'm unsure whether it's a defect of the particular chair I got or a larger issue with the entire line) is that the adjustable lumbar won't stay in place, as it tends to slide down when put into higher positions. overall, I'm happy with it",4,1.0,0,0,False,Verve Chair,,//www.branchfurniture.com/products/verve-chair,https://cdn.shopify.com/s/files/1/0124/5662/4187/products/coralherocopy_x280.jpg?v=1652368917,,,,,0,not mentioned,1,positive,1,negative,1,negative,0,not mentioned,1,positive,1,positive,0,not mentioned,0,not mentioned,1,positive,0,not mentioned,1,negative,1,positive,1,positive,0,not mentioned,0,not mentioned,0,not mentioned,0,not mentioned,0,not mentioned,0,not mentioned
2023-04-16T18:41:44.877Z,2023-04-16T18:41:44.877Z,approved,2024-11-28,"Solid option, arms are a flaw","Nice design, sturdy, easy to assemble; arms don’t come up high enough and don’t adjust forward at all. Could use some longer/stronger lumbar support.","Solid option, arms are a flaw: Nice design, sturdy, easy to assemble; arms don’t come up high enough and don’t adjust forward at all. Could use some longer/stronger lumbar support.",4,1.0,0,0,False,Verve Chair,,//www.branchfurniture.com/products/verve-chair,https://cdn.shopify.com/s/files/1/0124/5662/4187/products/coralherocopy_x280.jpg?v=1652368917,,,,,0,not mentioned,1,negative,1,negative,1,negative,0,not mentioned,1,positive,0,not mentioned,0,not mentioned,0,not mentioned,1,positive,0,not mentioned,1,negative,1,positive,0,not mentioned,0,not mentioned,0,not mentioned,0,not mentioned,1,positive,0,not mentioned,0,not mentioned
2023-04-16T18:33:24.097Z,2023-04-16T18:33:24.097Z,approved,2024-11-28,better than ergo,"better back than the ergo, would be perfect if the arms were more adjustable and could come closer or further laterally. Also the adjustments for the back need to be more fluid...","better than ergo: better back than the ergo, would be perfect if the arms were more adjustable and could come closer or further laterally. Also the adjustments for the back need to be more fluid...",4,1.0,0,0,False,Verve Chair,,//www.branchfurniture.com/products/verve-chair,https://cdn.shopify.com/s/files/1/0124/5662/4187/products/coralherocopy_x280.jpg?v=1652368917,,,,,0,not mentioned,1,negative,1,negative,1,positive,1,positive,0,not mentioned,0,not mentioned,0,not mentioned,0,not mentioned,0,not mentioned,0,not mentioned,1,positive,0,not mentioned,1,positive,0,not mentioned,0,not mentioned,0,not mentioned,0,not mentioned,0,not mentioned,0,not mentioned
2023-04-12T17:14:02.063Z,2023-04-12T17:14:02.063Z,approved,2024-11-28,It's a solid work chair,Easy to build. Looks nice. Comfortable to sit in for long work days. Arm rest could be better but not a deal breaker for me (my last chair had only 1 arm rest that was even less customizable and the other broke off during a move). Upgraded from a more economical chair. Share this chair with my wife who's smaller than I am.,It's a solid work chair: Easy to build. Looks nice. Comfortable to sit in for long work days. Arm rest could be better but not a deal breaker for me (my last chair had only 1 arm rest that was even less customizable and the other broke off during a move). Upgraded from a more economical chair. Share this chair with my wife who's smaller than I am.,4,1.0,0,0,False,Verve Chair,,//www.branchfurniture.com/products/verve-chair,https://cdn.shopify.com/s/files/1/0124/5662/4187/products/coralherocopy_x280.jpg?v=1652368917,,,,,1,positive,1,neutral,1,negative,1,neutral,0,not mentioned,1,positive,1,positive,0,not mentioned,0,not mentioned,1,positive,0,not mentioned,0,not mentioned,1,positive,1,positive,0,not mentioned,0,not mentioned,0,not mentioned,1,positive,0,not mentioned,0,not mentioned
2023-04-12T13:06:04.747Z,2023-04-12T13:06:04.747Z,approved,2024-11-28,Great chair!,"The chair is really great, just have two small issues. The seat tension is difficult to adjust and my arm rests wobble slightly","Great chair!: The chair is really great, just have two small issues. The seat tension is difficult to adjust and my arm rests wobble slightly",4,1.0,0,0,False,Verve Chair,,//www.branchfurniture.com/products/verve-chair,https://cdn.shopify.com/s/files/1/0124/5662/4187/products/coralherocopy_x280.jpg?v=1652368917,,,,,0,not mentioned,1,negative,1,negative,0,not mentioned,0,not mentioned,1,positive,0,not mentioned,0,not mentioned,0,not mentioned,0,not mentioned,0,not mentioned,0,not mentioned,0,not mentioned,0,not mentioned,0,not mentioned,0,not mentioned,0,not mentioned,0,not mentioned,0,not mentioned,0,not mentioned
